"","navn","ministerpost","parti","start","stop","regering","r_start","r_stop","time","early"
"1","C.C. Zahrtmann"," Marineminister ",NA,1848-04-06,1848-11-16,"Regeringen-Moltke-I",1848-03-22,1848-11-16,0.61202185792331,0
"2","C.E. Bardenfleth"," Justitsminister ",NA,1848-03-22,1848-11-16,"Regeringen-Moltke-I",1848-03-22,1848-11-16,0.653005464480657,0
"3","A.F. Tscherning"," Krigsminister ",NA,1848-03-22,1848-11-16,"Regeringen-Moltke-I",1848-03-22,1848-11-16,0.653005464480657,0
"4","D.G. Monrad"," Kultusminister ",NA,1848-03-22,1848-11-16,"Regeringen-Moltke-I",1848-03-22,1848-11-16,0.653005464480657,0
"5","C.A. Blume"," Handelsminister",NA,1848-03-22,1848-11-16,"Regeringen-Moltke-I",1848-03-22,1848-11-16,0.653005464480657,0
"6","Wilhelm Sponneck"," Finansminister ",NA,1848-11-16,1851-07-13,"Regeringen-Moltke-II",1848-11-16,1851-07-13,2.6544501833971,0
"7","F. Tillisch"," Minister for Slesvig ",NA,1851-03-05,1851-07-13,"Regeringen-Moltke-II",1848-11-16,1851-07-13,0.356164383561691,0
"8","J.N. Madvig"," Kultusminister ",NA,1848-11-16,1851-07-13,"Regeringen-Moltke-II",1848-11-16,1851-07-13,2.6544501833971,0
"9","C.E. Bardenfleth"," Justitsminister ",NA,1848-11-16,1851-07-13,"Regeringen-Moltke-II",1848-11-16,1851-07-13,2.6544501833971,0
"10","C.F. Hansen"," Krigsminister ",NA,1848-11-16,1851-07-13,"Regeringen-Moltke-II",1848-11-16,1851-07-13,2.6544501833971,0
"11","Holger Reedtz"," Udenrigsminister ",NA,1850-08-06,1851-07-13,"Regeringen-Moltke-II",1848-11-16,1851-07-13,0.934246575342513,0
"12","C.C. Zahrtmann"," Marineminister ",NA,1848-11-16,1850-08-10,"Regeringen-Moltke-II",1848-11-16,1851-07-13,1.73116251216425,1
"13","Carl L.C. Irminger"," Marineminister ",NA,1850-08-10,1850-11-25,"Regeringen-Moltke-II",1848-11-16,1851-07-13,0.293150684931561,1
"14","C. van Dockum"," Marineminister ",NA,1850-11-25,1851-07-13,"Regeringen-Moltke-II",1848-11-16,1851-07-13,0.630136986301295,0
"15","P.G. Bang"," Indenrigsminister ",NA,1848-11-16,1849-09-21,"Regeringen-Moltke-II",1848-11-16,1851-07-13,0.846231005314849,1
"16","A.W. Moltke"," Premierminister ",NA,1851-07-13,1851-10-18,"Regeringen-Moltke-III",1851-07-13,1851-10-18,0.265753424657532,0
"17","Wilhelm Sponneck"," Finansminister ",NA,1851-07-13,1851-10-18,"Regeringen-Moltke-III",1851-07-13,1851-10-18,0.265753424657532,0
"18","F. Tillisch"," Indenrigsminister ",NA,1851-07-13,1851-10-18,"Regeringen-Moltke-III",1851-07-13,1851-10-18,0.265753424657532,0
"19","J.N. Madvig"," Kultusminister ",NA,1851-07-13,1851-10-18,"Regeringen-Moltke-III",1851-07-13,1851-10-18,0.265753424657532,0
"20","C.E. Bardenfleth"," Minister for Slesvig ",NA,1851-07-13,1851-10-18,"Regeringen-Moltke-III",1851-07-13,1851-10-18,0.265753424657532,0
"21","Carl Moltke"," u.p. ",NA,1851-07-13,1851-10-18,"Regeringen-Moltke-III",1851-07-13,1851-10-18,0.265753424657532,0
"22","Holger Reedtz"," Udenrigsminister ",NA,1851-07-13,1851-10-18,"Regeringen-Moltke-III",1851-07-13,1851-10-18,0.265753424657532,0
"23","Jacob Fibiger"," Krigsminister ",NA,1851-07-13,1851-10-18,"Regeringen-Moltke-III",1851-07-13,1851-10-18,0.265753424657532,0
"24","C. van Dockum"," Marineminister ",NA,1851-07-13,1851-10-18,"Regeringen-Moltke-III",1851-07-13,1851-10-18,0.265753424657532,0
"25","A.W. Scheel"," Justitsminister",NA,1851-07-13,1851-10-18,"Regeringen-Moltke-III",1851-07-13,1851-10-18,0.265753424657532,0
"26","A.W. Moltke"," Premierminister ",NA,1851-10-18,1852-01-27,"Regeringen-Moltke-IV",1851-10-18,1852-01-27,0.27651770342095,0
"27","Wilhelm Sponneck"," Finansminister ",NA,1851-10-18,1852-01-27,"Regeringen-Moltke-IV",1851-10-18,1852-01-27,0.27651770342095,0
"28","F. Tillisch"," Indenrigsminister ",NA,1851-10-18,1852-01-27,"Regeringen-Moltke-IV",1851-10-18,1852-01-27,0.27651770342095,0
"29","J.N. Madvig"," Kultusminister ",NA,1851-10-18,1851-12-07,"Regeringen-Moltke-IV",1851-10-18,1852-01-27,0.136986301369916,1
"30","C.E. Bardenfleth"," Minister for Slesvig ",NA,1851-10-18,1852-01-27,"Regeringen-Moltke-IV",1851-10-18,1852-01-27,0.27651770342095,0
"31","P.C. Bang"," Kultusminister ",NA,1851-12-07,1852-01-27,"Regeringen-Moltke-IV",1851-10-18,1852-01-27,0.139531402051034,0
"32","C.A. Bluhme"," Udenrigsminister ",NA,1851-10-18,1852-01-27,"Regeringen-Moltke-IV",1851-10-18,1852-01-27,0.27651770342095,0
"33","C. van Dockum"," Marineminister ",NA,1851-10-18,1852-01-27,"Regeringen-Moltke-IV",1851-10-18,1852-01-27,0.27651770342095,0
"34","C.J. Flensborg"," Krigsminister ",NA,1851-10-18,1852-01-27,"Regeringen-Moltke-IV",1851-10-18,1852-01-27,0.27651770342095,0
"35","A.W. Scheel"," Justitsminister",NA,1851-10-18,1852-01-27,"Regeringen-Moltke-IV",1851-10-18,1852-01-27,0.27651770342095,0
"36","Wilhelm Sponneck"," Finansminister ",NA,1852-01-27,1853-04-21,"Regeringen-Bluhme-I",1852-01-27,1853-04-21,1.23033161164744,0
"37","Heinrich Reventlow-Criminil"," Minister for Holsten og Lauenborg ",NA,1852-01-27,1853-04-21,"Regeringen-Bluhme-I",1852-01-27,1853-04-21,1.23033161164744,0
"38","A.W. Scheel"," Justitsminister ",NA,1852-01-27,1853-04-21,"Regeringen-Bluhme-I",1852-01-27,1853-04-21,1.23033161164744,0
"39","Carl Moltke"," Minister for Slesvig ",NA,1852-01-27,1853-04-21,"Regeringen-Bluhme-I",1852-01-27,1853-04-21,1.23033161164744,0
"40","C.F. Hansen"," Krigsminister ",NA,1852-01-27,1853-04-21,"Regeringen-Bluhme-I",1852-01-27,1853-04-21,1.23033161164744,0
"41","Carl Simony"," Kultusminister ",NA,1852-06-03,1853-04-21,"Regeringen-Bluhme-I",1852-01-27,1853-04-21,0.880604835691202,0
"42","Steen Bille"," Marineminister",NA,1852-01-27,1853-04-21,"Regeringen-Bluhme-I",1852-01-27,1853-04-21,1.23033161164744,0
"43","F. Wolfhagen"," Minister for Slesvig ",NA,1856-06-18,1856-10-18,"Regeringen-Bang",1854-12-12,1856-10-18,0.333333333333258,0
"44","Mathias Lüttichau"," Krigsminister ",NA,1854-12-12,1856-05-25,"Regeringen-Bang",1854-12-12,1856-10-18,1.45096938393613,1
"45","Harald Raasløff"," Minister for Slesvig ",NA,1854-12-12,1856-02-18,"Regeringen-Bang",1854-12-12,1856-10-18,1.1859420615317,1
"46","Carl Simony"," Indenrigsminister ",NA,1856-02-18,1856-06-04,"Regeringen-Bang",1854-12-12,1856-10-18,0.29234972677591,1
"47","Wilhelm Michelsen"," Marineminister ",NA,1854-12-12,1856-10-18,"Regeringen-Bang",1854-12-12,1856-10-18,1.84987648776109,0
"48","I.J. Unsgaard"," Indenrigsminister ",NA,1856-06-04,1856-10-18,"Regeringen-Bang",1854-12-12,1856-10-18,0.371584699453479,0
"49","Carl Lundbye"," Krigsminister ",NA,1856-05-25,1856-10-18,"Regeringen-Bang",1854-12-12,1856-10-18,0.398907103824968,0
"50","C.G. Andræ"," Finansminister ",NA,1854-12-12,1856-10-18,"Regeringen-Bang",1854-12-12,1856-10-18,1.84987648776109,0
"51","W. Scheel-Plessen"," Udenrigsminister ",NA,1854-12-12,1855-01-15,"Regeringen-Bang",1854-12-12,1856-10-18,0.0931506849315156,1
"52","A.W. Scheel"," Justitsminister",NA,1854-12-12,1855-01-15,"Regeringen-Bang",1854-12-12,1856-10-18,0.0931506849315156,1
"53","A.F. Krieger"," Indenrigsminister ",NA,1856-10-18,1857-05-13,"Regeringen-Andrae",1856-10-18,1857-05-13,0.566561868403369,0
"54","F. Wolfhagen"," Minister for Slesvig ",NA,1856-10-18,1857-05-13,"Regeringen-Andrae",1856-10-18,1857-05-13,0.566561868403369,0
"55","C.C. Hall"," Kultusminister ",NA,1856-10-18,1857-05-13,"Regeringen-Andrae",1856-10-18,1857-05-13,0.566561868403369,0
"56","Carl Simony"," Jutitsminister ",NA,1856-10-18,1857-05-13,"Regeringen-Andrae",1856-10-18,1857-05-13,0.566561868403369,0
"57","Wilhelm Michelsen"," Marineminister ",NA,1856-10-18,1857-05-13,"Regeringen-Andrae",1856-10-18,1857-05-13,0.566561868403369,0
"58","I.J. Unsgaard"," Minister for Monarkiets fælles indre anliggender ",NA,1856-10-18,1857-05-13,"Regeringen-Andrae",1856-10-18,1857-05-13,0.566561868403369,0
"59","Carl Lundbye"," Krigsminister ",NA,1856-10-18,1857-05-13,"Regeringen-Andrae",1856-10-18,1857-05-13,0.566561868403369,0
"60","C.G. Andræ"," Finansminister ",NA,1857-05-13,1858-07-10,"Regeringen-Hall-I",1857-05-13,1859-12-02,1.158904109589,1
"61","F. Wolfhagen"," Minister for Slesvig ",NA,1857-05-13,1859-12-02,"Regeringen-Hall-I",1857-05-13,1859-12-02,2.55616438356174,0
"62","Carl Lundbye"," Krigsminister ",NA,1857-05-13,1859-12-02,"Regeringen-Hall-I",1857-05-13,1859-12-02,2.55616438356174,0
"63","D.G. Monrad"," Kultusminister",NA,1859-05-06,1859-12-02,"Regeringen-Hall-I",1857-05-13,1859-12-02,0.575342465753465,0
"64","Hans Nicolai Thestrup"," Marineminister; Krigsminister ",NA,1859-12-02,1860-02-24,"Regeringen-Rotwitt",1859-12-02,1860-02-24,0.229732764428491,0
"65","V.A. Borgen"," Kultusminister",NA,1859-12-02,1860-02-24,"Regeringen-Rotwitt",1859-12-02,1860-02-24,0.229732764428491,0
"66","C.E. Fenger"," Finansminister ",NA,1860-02-24,1863-12-31,"Regeringen-Hall-II",1860-02-24,1863-12-31,3.84971929036601,0
"67","Orla Lehmann"," Indenrigsminister ",NA,1861-09-15,1863-12-31,"Regeringen-Hall-II",1860-02-24,1863-12-31,2.29315068493156,0
"68","Harald Raasløff"," Minister for Holsten og Lauenborg ",NA,1860-02-24,1861-03-30,"Regeringen-Hall-II",1860-02-24,1863-12-31,1.09355490680423,1
"69","Steen Bille"," Marineminister ",NA,1860-02-24,1863-12-31,"Regeringen-Hall-II",1860-02-24,1863-12-31,3.84971929036601,0
"70","Hans Nicolai Thestrup"," Krigsminister ",NA,1860-02-24,1863-08-13,"Regeringen-Hall-II",1860-02-24,1863-12-31,3.46615764653029,1
"71","A.L. Casse"," Justitsminister ",NA,1860-02-24,1863-12-31,"Regeringen-Hall-II",1860-02-24,1863-12-31,3.84971929036601,0
"72","F. Wolfhagen"," Minister for Slesvig ",NA,1860-02-24,1863-12-31,"Regeringen-Hall-II",1860-02-24,1863-12-31,3.84971929036601,0
"73","Carl Lundbye"," Krigsminister",NA,1863-08-13,1863-12-31,"Regeringen-Hall-II",1860-02-24,1863-12-31,0.383561643835719,0
"74","A.L. Casse"," Justitsminister ",NA,1863-12-31,1864-07-11,"Regeringen-Monrad",1863-12-31,1864-07-11,0.52732988996172,0
"75","Wilhelm Johannsen"," Minister for Slesvig ",NA,1864-01-24,1864-07-11,"Regeringen-Monrad",1863-12-31,1864-07-11,0.461748633879779,0
"76","Carl v. Nutzhorn"," Indenrigsminister ",NA,1863-12-31,1864-05-10,"Regeringen-Monrad",1863-12-31,1864-07-11,0.357930982857852,1
"77","George Quaade"," Udenrigsminister ",NA,1864-01-08,1864-07-11,"Regeringen-Monrad",1863-12-31,1864-07-11,0.505464480874252,0
"78","Carl Simony"," Minister for Slesvig ",NA,1863-12-31,1864-01-24,"Regeringen-Monrad",1863-12-31,1864-07-11,0.0655812560819413,1
"79","C.E. Reich"," Krigsminister ",NA,1864-05-18,1864-07-11,"Regeringen-Monrad",1863-12-31,1864-07-11,0.147540983606405,0
"80","C.T. Engelstoft"," Kultusminister ",NA,1863-12-31,1864-07-11,"Regeringen-Monrad",1863-12-31,1864-07-11,0.52732988996172,0
"81","Carl Lundbye"," Krigsminister ",NA,1863-12-31,1864-05-18,"Regeringen-Monrad",1863-12-31,1864-07-11,0.379788906355316,1
"82","H.R. Carlsen"," Indenrigsminister ",NA,1864-05-10,1864-07-11,"Regeringen-Monrad",1863-12-31,1864-07-11,0.169398907103869,0
"83","O.H. Lütken"," Marineminister",NA,1863-12-31,1864-07-11,"Regeringen-Monrad",1863-12-31,1864-07-11,0.52732988996172,0
"84","C.N. David"," Finansminister ",NA,1864-07-11,1865-11-06,"Regeringen-Bluhme-II",1864-07-11,1865-11-06,1.32198517853135,0
"85","F. Tillisch"," Indenrigsminister ",NA,1864-07-11,1865-11-06,"Regeringen-Bluhme-II",1864-07-11,1865-11-06,1.32198517853135,0
"86","O.H. Lütken"," Marineminister ",NA,1864-07-11,1865-11-06,"Regeringen-Bluhme-II",1864-07-11,1865-11-06,1.32198517853135,0
"87","Carl Moltke"," Minister uden porteføjle ",NA,1865-05-13,1865-07-05,"Regeringen-Bluhme-II",1864-07-11,1865-11-06,0.145205479451988,1
"88","C.F. Hansen"," Krigsminister ",NA,1864-07-11,1865-11-06,"Regeringen-Bluhme-II",1864-07-11,1865-11-06,1.32198517853135,0
"89","Wilhelm Johannsen"," Minister for Slesvig",NA,1864-07-11,1864-11-18,"Regeringen-Bluhme-II",1864-07-11,1865-11-06,0.355191256830722,1
"90","Aleth Hansen"," Kultusminister ",NA,1868-03-15,1869-09-22,"Regeringen-krag-juel-vind-frijs",1865-11-06,1870-05-28,1.52110187888297,1
"91","Carl v. Nutzhorn"," Justitsminister ",NA,1868-08-10,1870-05-28,"Regeringen-krag-juel-vind-frijs",1865-11-06,1870-05-28,1.79618234897816,0
"92","C. Leuning"," Justitsminister ",NA,1865-11-06,1867-07-21,"Regeringen-krag-juel-vind-frijs",1865-11-06,1870-05-28,1.70410958904108,1
"93","Otto Fr. Suenson"," Marineminister ",NA,1867-11-01,1869-09-22,"Regeringen-krag-juel-vind-frijs",1865-11-06,1870-05-28,1.89041095890411,1
"94","Wolfgang Haffner"," Indenrigsminister ",NA,1869-09-22,1870-05-28,"Regeringen-krag-juel-vind-frijs",1865-11-06,1870-05-28,0.679452054794638,0
"95","Hans Herman Grove"," Marineminister ",NA,1865-11-06,1866-08-17,"Regeringen-krag-juel-vind-frijs",1865-11-06,1870-05-28,0.778082191780868,1
"96","P.C. Kierkegaard"," Kultusminister ",NA,1867-09-04,1868-03-06,"Regeringen-krag-juel-vind-frijs",1865-11-06,1870-05-28,0.503623025675552,1
"97","E. Emil Rosenørn"," Kultusminister ",NA,1869-09-22,1870-05-28,"Regeringen-krag-juel-vind-frijs",1865-11-06,1870-05-28,0.679452054794638,0
"98","Theodor Rosenørn-Teilmann"," Justitsminister ",NA,1867-07-21,1868-08-10,"Regeringen-krag-juel-vind-frijs",1865-11-06,1870-05-28,1.05587244554249,1
"99","J.W. Neergaard"," Krigsminister ",NA,1865-11-06,1866-09-29,"Regeringen-krag-juel-vind-frijs",1865-11-06,1870-05-28,0.895890410959055,1
"100","C. van Dockum"," Marineminister ",NA,1866-09-17,1867-11-01,"Regeringen-krag-juel-vind-frijs",1865-11-06,1870-05-28,1.1232876712329,1
"101","C.E. Fenger"," Finansminister ",NA,1870-05-28,1874-07-14,"Regeringen-Holstein-Holsteinborg",1870-05-28,1874-07-14,4.12876712328762,0
"102","C.C. Hall"," Kultusminister ",NA,1870-05-28,1874-07-14,"Regeringen-Holstein-Holsteinborg",1870-05-28,1874-07-14,4.12876712328762,0
"103","C.A. Fonnesbech"," Indenrigsminister ",NA,1870-05-28,1874-07-14,"Regeringen-Holstein-Holsteinborg",1870-05-28,1874-07-14,4.12876712328762,0
"104","Niels F. Ravn"," Marineminister ",NA,1873-05-21,1874-07-14,"Regeringen-Holstein-Holsteinborg",1870-05-28,1874-07-14,1.14794520547935,0
"105","Otto Rosenørn-Lehn"," Udenrigsminister ",NA,1870-05-28,1874-07-14,"Regeringen-Holstein-Holsteinborg",1870-05-28,1874-07-14,4.12876712328762,0
"106","C.S. Klein"," Justitsminister ",NA,1872-06-26,1874-07-14,"Regeringen-Holstein-Holsteinborg",1870-05-28,1874-07-14,2.04790029193805,0
"107","J.J.A. Worsaae"," Kultusminister ",NA,1874-07-14,1875-06-11,"Regeringen-Fonnesbech",1874-07-14,1875-06-11,0.909589041095842,0
"108","Frederik Tobiesen"," Indenrigsminister ",NA,1874-07-14,1875-06-11,"Regeringen-Fonnesbech",1874-07-14,1875-06-11,0.909589041095842,0
"109","Otto Rosenørn-Lehn"," Udenrigsminister ",NA,1874-07-14,1875-06-11,"Regeringen-Fonnesbech",1874-07-14,1875-06-11,0.909589041095842,0
"110","P.F. Steinmann"," Krigsminister",NA,1874-08-26,1875-06-11,"Regeringen-Fonnesbech",1874-07-14,1875-06-11,0.791780821917655,0
"111","Hilmar Finsen"," Indenrigsminister ",NA,1884-08-29,1885-08-07,"Regeringen-Estrup",1875-06-11,1894-08-07,0.938790328617415,1
"112","H. Hørring"," Indenrigsminister ",NA,1894-01-15,1894-08-07,"Regeringen-Estrup",1875-06-11,1894-08-07,0.558904109589093,0
"113","Erik Skell"," Indenrigsminister ",NA,1875-06-11,1884-08-29,"Regeringen-Estrup",1875-06-11,1894-08-07,9.21737405494423,1
"114","Otto Rosenørn-Lehn"," Udenrigsminister ",NA,1875-10-01,1892-05-21,"Regeringen-Estrup",1875-06-11,1894-08-07,16.6373006961599,1
"115","W. Kaufmann"," Krigsminister ",NA,1879-01-04,1881-04-01,"Regeringen-Estrup",1875-06-11,1894-08-07,2.2383561643835,1
"116","Jesper Bahnson"," Krigsminister ",NA,1884-09-12,1894-08-07,"Regeringen-Estrup",1875-06-11,1894-08-07,9.90053896249719,0
"117","Tage Reedtz-Thott"," Udenrigsminister ",NA,1892-05-21,1894-08-07,"Regeringen-Estrup",1875-06-11,1894-08-07,2.21201437233321,0
"118","C. Goos"," Kultusminister ",NA,1891-07-10,1894-08-07,"Regeringen-Estrup",1875-06-11,1894-08-07,3.07671232876714,0
"119","J.C.H. Fisher"," Kultusminister ",NA,1875-06-11,1880-08-24,"Regeringen-Estrup",1875-06-11,1894-08-07,5.2037128527586,1
"120","Fr. Moltke"," Udenrigsminister ",NA,1875-06-11,1875-10-01,"Regeringen-Estrup",1875-06-11,1894-08-07,0.306849315068575,1
"121","Jacob Scavenius"," Kultusminister",NA,1880-08-24,1891-07-06,"Regeringen-Estrup",1875-06-11,1894-08-07,10.8647802979265,1
"122","Chr. Lüttichau"," Finansminister ",NA,1894-08-07,1897-05-23,"Regeringen-Reedtz-Thott",1894-08-07,1897-05-23,2.79178082191788,0
"123","V. Bardenfleth"," Kultusminister ",NA,1894-08-07,1897-05-23,"Regeringen-Reedtz-Thott",1894-08-07,1897-05-23,2.79178082191788,0
"124","Knud Sehested"," Landbrugsminister ",NA,1896-05-22,1897-05-23,"Regeringen-Reedtz-Thott",1894-08-07,1897-05-23,1.00106295381397,0
"125","N.F. Ravn"," Marineminister ",NA,1894-08-07,1897-05-23,"Regeringen-Reedtz-Thott",1894-08-07,1897-05-23,2.79178082191788,0
"126","Gustav Schnack"," Krigsminister ",NA,1896-04-25,1897-05-23,"Regeringen-Reedtz-Thott",1894-08-07,1897-05-23,1.07483344561729,0
"127","H.P. Ingerslev"," Minister for offentlige arbejder ",NA,1894-08-07,1896-04-20,"Regeringen-Reedtz-Thott",1894-08-07,1897-05-23,1.70328617411496,1
"128","C.A.F. Thomsen"," Krigsminister",NA,1894-08-07,1896-04-25,"Regeringen-Reedtz-Thott",1894-08-07,1897-05-23,1.7169473763006,1
"129","C. Tuxen"," Krigsminister ",NA,1897-05-23,1899-08-28,"Regeringen-Hoerring",1897-05-23,1900-04-27,2.26575342465753,1
"130","Gustav Schnack"," Krigsminister ",NA,1899-08-28,1900-04-27,"Regeringen-Hoerring",1897-05-23,1900-04-27,0.663013698630039,0
"131","H.V. Sthyr"," Kultusminister ",NA,1897-05-23,1900-04-27,"Regeringen-Hoerring",1897-05-23,1900-04-27,2.92876712328757,0
"132","Ludvig Bramsen"," Indenrigsminister ",NA,1899-08-28,1900-04-27,"Regeringen-Hoerring",1897-05-23,1900-04-27,0.663013698630039,0
"133","V. Bardenfleth"," Indenrigsminister ",NA,1897-05-23,1899-08-28,"Regeringen-Hoerring",1897-05-23,1900-04-27,2.26575342465753,1
"134","Alfred Hage"," Landbrugsminister",NA,1897-05-23,1900-04-27,"Regeringen-Hoerring",1897-05-23,1900-04-27,2.92876712328757,0
"135","Hannibal Sehested"," Konsejlspræsident ",NA,1900-04-27,1901-07-24,"Regeringen-Sehested",1900-04-27,1901-07-24,1.24109589041109,0
"136","William Scharling"," Finansminister ",NA,1900-04-27,1901-07-24,"Regeringen-Sehested",1900-04-27,1901-07-24,1.24109589041109,0
"137","Fr. Friis"," Landbrugsminister ",NA,1900-04-27,1901-07-24,"Regeringen-Sehested",1900-04-27,1901-07-24,1.24109589041109,0
"138","Chr. Juul-Rysensteen"," Minister for offentlige arbejder ",NA,1900-04-27,1901-07-24,"Regeringen-Sehested",1900-04-27,1901-07-24,1.24109589041109,0
"139","Gustav Schnack"," Krigsminister ",NA,1900-04-27,1901-07-24,"Regeringen-Sehested",1900-04-27,1901-07-24,1.24109589041109,0
"140","Chr. G. Middelboe"," Marineminister ",NA,1900-04-27,1901-07-24,"Regeringen-Sehested",1900-04-27,1901-07-24,1.24109589041109,0
"141","Ludwig Bramsen"," Indenrigsminister ",NA,1900-04-27,1901-07-24,"Regeringen-Sehested",1900-04-27,1901-07-24,1.24109589041109,0
"142","J.J. Bjerre"," Kultusminister ",NA,1900-04-27,1901-07-24,"Regeringen-Sehested",1900-04-27,1901-07-24,1.24109589041109,0
"143","C. Goos"," Jutitsminister",NA,1900-04-27,1901-07-24,"Regeringen-Sehested",1900-04-27,1901-07-24,1.24109589041109,0
"144","Christopher Hage"," Finansminister "," (V)",1901-07-24,1905-01-14,"Regeringen-Deuntzer",1901-07-24,1905-01-14,3.47671232876701,0
"145","V H. O. Madsen"," Krigsminister "," (V)",1901-07-24,1905-01-14,"Regeringen-Deuntzer",1901-07-24,1905-01-14,3.47671232876701,0
"146","Ferdinand Jøhnke"," Marineminister "," (V)",1901-07-24,1905-01-14,"Regeringen-Deuntzer",1901-07-24,1905-01-14,3.47671232876701,0
"147","J. C. Christensen"," Kultusminister "," (V)",1901-07-24,1905-01-14,"Regeringen-Deuntzer",1901-07-24,1905-01-14,3.47671232876701,0
"148","P. A. Alberti"," Justitsminister "," (V)",1901-07-24,1905-01-14,"Regeringen-Deuntzer",1901-07-24,1905-01-14,3.47671232876701,0
"149","Enevold Sørensen"," Indenrigsminister "," (V)",1901-07-24,1905-01-14,"Regeringen-Deuntzer",1901-07-24,1905-01-14,3.47671232876701,0
"150","V. Hørup"," Minister for offentlige arbejder † 15.02.1902 "," (V)",1901-07-24,1902-02-15,"Regeringen-Deuntzer",1901-07-24,1905-01-14,0.564383561643808,1
"151","Christopher Hage"," Minister for offentlige arbejder (fra 15.02.1902) "," (V)",1902-02-15,1905-01-14,"Regeringen-Deuntzer",1901-07-24,1905-01-14,2.9123287671232,0
"152","Ole Hansen"," Landbrugsminister "," (V)",1901-07-24,1905-01-14,"Regeringen-Deuntzer",1901-07-24,1905-01-14,3.47671232876701,0
"153","P. A. Alberti"," Minister for Island "," (V)",1901-07-24,1904-01-31,"Regeringen-Deuntzer",1901-07-24,1905-01-14,2.5230631035256,1
"154","Hannes Hafstein"," Minister for Island",NA,1904-01-31,1905-01-14,"Regeringen-Deuntzer",1901-07-24,1905-01-14,0.953649225241406,0
"155","Frederik C.O. Raben-Levetzau"," Udenrigsminister "," (V)",1905-01-14,1908-07-24,"Regeringen-Christensen-i",1905-01-14,1908-07-24,3.52449285126136,0
"156","Vilhelm Lassen"," Finansminister † 06.04.1908 "," (V)",1905-01-14,1908-04-06,"Regeringen-Christensen-i",1905-01-14,1908-07-24,3.22667864361119,1
"157","Enevold Sørensen"," Kultusminister "," (V)",1905-01-14,1908-07-24,"Regeringen-Christensen-i",1905-01-14,1908-07-24,3.52449285126136,0
"158","P. A. Alberti"," Justitsminister "," (V)",1905-01-14,1908-07-24,"Regeringen-Christensen-i",1905-01-14,1908-07-24,3.52449285126136,0
"159","Sigurd Berg"," Indenrigsminister "," (V)",1905-01-14,1908-07-24,"Regeringen-Christensen-i",1905-01-14,1908-07-24,3.52449285126136,0
"160","Svend Høgsbro"," Minister for offentlige arbejder "," (V)",1905-01-14,1908-07-24,"Regeringen-Christensen-i",1905-01-14,1908-07-24,3.52449285126136,0
"161","Ole Hansen"," Landbrugsminister "," (V)",1905-01-14,1908-07-24,"Regeringen-Christensen-i",1905-01-14,1908-07-24,3.52449285126136,0
"162","Hannes Hafstein"," Minister for Island",NA,1905-01-14,1908-07-24,"Regeringen-Christensen-i",1905-01-14,1908-07-24,3.52449285126136,0
"163","Frederik C.O. Raben-Levetzau"," Udenrigsminister "," (V)",1908-07-24,1908-10-12,"Regeringen-Christensen-ii",1908-07-24,1908-10-12,0.218579234972594,0
"164","N. Neergaard"," Finansminister "," (V)",1908-07-24,1908-10-12,"Regeringen-Christensen-ii",1908-07-24,1908-10-12,0.218579234972594,0
"165","Enevold Sørensen"," Kultusminister "," (V)",1908-07-24,1908-10-12,"Regeringen-Christensen-ii",1908-07-24,1908-10-12,0.218579234972594,0
"166","Svend Høgsbro"," Justitsminister "," (V)",1908-07-24,1908-10-12,"Regeringen-Christensen-ii",1908-07-24,1908-10-12,0.218579234972594,0
"167","Sigurd Berg"," Indenrigsminister "," (V)",1908-07-24,1908-10-12,"Regeringen-Christensen-ii",1908-07-24,1908-10-12,0.218579234972594,0
"168","J.Jensen- Sønderup"," Minister for offentlige arbejder "," (V)",1908-07-24,1908-10-12,"Regeringen-Christensen-ii",1908-07-24,1908-10-12,0.218579234972594,0
"169","Anders Nielsen"," Landbrugsminister "," (V)",1908-07-24,1908-10-12,"Regeringen-Christensen-ii",1908-07-24,1908-10-12,0.218579234972594,0
"170","Hannes Hafstein"," Minister for Island",NA,1908-07-24,1908-10-12,"Regeringen-Christensen-ii",1908-07-24,1908-10-12,0.218579234972594,0
"171","C. W. Ahlefeldt-Laurvig (V)"," Udenrigsminister ","(en)",1908-10-12,1909-08-16,"Regeringen-Neergaard-I",1908-10-12,1909-08-16,0.843229283629171,0
"172","Charles Brun"," Finansminister "," (V)",1908-10-12,1909-08-16,"Regeringen-Neergaard-I",1908-10-12,1909-08-16,0.843229283629171,0
"173","Enevold Sørensen"," Kultusminister "," (V)",1908-10-12,1909-08-16,"Regeringen-Neergaard-I",1908-10-12,1909-08-16,0.843229283629171,0
"174","Svend Høgsbro"," Justitsminister "," (V)",1908-10-12,1909-08-16,"Regeringen-Neergaard-I",1908-10-12,1909-08-16,0.843229283629171,0
"175","Klaus Berntsen "," Indenrigsminister "," (V)",1908-10-12,1909-08-16,"Regeringen-Neergaard-I",1908-10-12,1909-08-16,0.843229283629171,0
"176","J.Jensen-Sønderup"," Minister for offentlige arbejder "," (V)",1908-10-12,1909-08-16,"Regeringen-Neergaard-I",1908-10-12,1909-08-16,0.843229283629171,0
"177","Anders Nielsen "," Landbrugsminister "," (V)",1908-10-12,1909-08-16,"Regeringen-Neergaard-I",1908-10-12,1909-08-16,0.843229283629171,0
"178","Johan Hansen"," Minister for handel og søfart "," (V)",1908-10-12,1909-08-16,"Regeringen-Neergaard-I",1908-10-12,1909-08-16,0.843229283629171,0
"179","Hannes Hafstein"," Minister for Island ",NA,1908-10-12,1909-03-31,"Regeringen-Neergaard-I",1908-10-12,1909-08-16,0.465147091848394,1
"180","Bjørn Jonsson"," Minister for Island",NA,1909-03-31,1909-08-16,"Regeringen-Neergaard-I",1908-10-12,1909-08-16,0.378082191780777,0
"181","J. L. Holstein-Ledreborg"," Konseilspræsident "," (V)",1909-08-16,1909-10-28,"Regeringen-Holstein-Ledreborg",1909-08-16,1909-10-28,0.200000000000045,0
"182","C. W. Ahlefeldt-Laurvig (V)"," Udenrigsminister ","(en)",1909-08-16,1909-10-28,"Regeringen-Holstein-Ledreborg",1909-08-16,1909-10-28,0.200000000000045,0
"183","N. Neergaand"," Finansminister "," (V)",1909-08-16,1909-10-28,"Regeringen-Holstein-Ledreborg",1909-08-16,1909-10-28,0.200000000000045,0
"184","J. C. Christensen"," Forsvarsminister "," (V)",1909-08-16,1909-10-18,"Regeringen-Holstein-Ledreborg",1909-08-16,1909-10-28,0.172602739726017,1
"185","J. L. Holstein-Ledreborg"," Forsvarsminister "," (V)",1909-10-18,1909-10-28,"Regeringen-Holstein-Ledreborg",1909-08-16,1909-10-28,0.0273972602740287,0
"186","Enevold Sørensen"," Kultusminister "," (V)",1909-08-16,1909-10-28,"Regeringen-Holstein-Ledreborg",1909-08-16,1909-10-28,0.200000000000045,0
"187","Svend Høgsbro"," Justitsminister "," (V)",1909-08-16,1909-10-28,"Regeringen-Holstein-Ledreborg",1909-08-16,1909-10-28,0.200000000000045,0
"188","Klaus Berntsen"," Indenrigsminister "," (V)",1909-08-16,1909-10-28,"Regeringen-Holstein-Ledreborg",1909-08-16,1909-10-28,0.200000000000045,0
"189","Thomas Larsen"," Minister for offentlige arbejder "," (V)",1909-08-16,1909-10-28,"Regeringen-Holstein-Ledreborg",1909-08-16,1909-10-28,0.200000000000045,0
"190","Anders Nielsen"," Landbrugsminister "," (V)",1909-08-16,1909-10-28,"Regeringen-Holstein-Ledreborg",1909-08-16,1909-10-28,0.200000000000045,0
"191","Johan Hansen"," Minister for handel og søfart "," (V)",1909-08-16,1909-10-28,"Regeringen-Holstein-Ledreborg",1909-08-16,1909-10-28,0.200000000000045,0
"192","Bjørn Jonsson"," Minister for Island",NA,1909-08-16,1909-10-28,"Regeringen-Holstein-Ledreborg",1909-08-16,1909-10-28,0.200000000000045,0
"193","C. Th. Zahle"," Konseilspræsident "," (R)",1909-10-28,1910-07-05,"Regeringen-Zahle-I",1909-10-28,1910-07-05,0.684931506849125,0
"194","Erik Scavenius"," Udenrigsminister "," (R)",1909-10-28,1910-07-05,"Regeringen-Zahle-I",1909-10-28,1910-07-05,0.684931506849125,0
"195","Edvard Brandes"," Finansminister "," (R)",1909-10-28,1910-07-05,"Regeringen-Zahle-I",1909-10-28,1910-07-05,0.684931506849125,0
"196","Christopher Krabbe"," Forsvarsminister "," (R)",1909-10-28,1910-07-05,"Regeringen-Zahle-I",1909-10-28,1910-07-05,0.684931506849125,0
"197","M. C. B. Nielsen"," Kultusminister "," (R)",1909-10-28,1910-07-05,"Regeringen-Zahle-I",1909-10-28,1910-07-05,0.684931506849125,0
"198","C. Th. Zahle"," Justitsminister "," (R)",1909-10-28,1910-07-05,"Regeringen-Zahle-I",1909-10-28,1910-07-05,0.684931506849125,0
"199","P. Munch"," Indenrigsminister "," (R)",1909-10-28,1910-07-05,"Regeringen-Zahle-I",1909-10-28,1910-07-05,0.684931506849125,0
"200","J. J. Jensen (R)"," Minister for offentlige arbejder (til 02.02.1910) "," (Onsted)",1909-10-28,1910-02-02,"Regeringen-Zahle-I",1909-10-28,1910-07-05,0.265753424657532,1
"201","Wilhelm Weimann"," Minister for offentlige arbejder (a.i. fra 02.02.1910) "," (R)",1910-02-02,1910-07-05,"Regeringen-Zahle-I",1909-10-28,1910-07-05,0.419178082191593,0
"202","Poul Christensen"," Landbrugsminister "," (R)",1909-10-28,1910-07-05,"Regeringen-Zahle-I",1909-10-28,1910-07-05,0.684931506849125,0
"203","Wilhelm Weimann"," Minister for handel og søfart "," (R)",1909-10-28,1910-07-05,"Regeringen-Zahle-I",1909-10-28,1910-07-05,0.684931506849125,0
"204","Bjørn Jonsson"," Minister for Island",NA,1909-10-28,1910-07-05,"Regeringen-Zahle-I",1909-10-28,1910-07-05,0.684931506849125,0
"205","Klaus Berntsen"," Konseilspræsident "," (V)",1910-07-05,1913-06-21,"Regeringen-Berntsen",1910-07-05,1913-06-21,2.96164383561654,0
"206","C. W. Ahlefeldt-Laurvig (V)"," Udenrigsminister ","(en)",1910-07-05,1913-06-21,"Regeringen-Berntsen",1910-07-05,1913-06-21,2.96164383561654,0
"207","Jacob Appel"," Kultusminister "," (V)",1910-07-05,1913-06-21,"Regeringen-Berntsen",1910-07-05,1913-06-21,2.96164383561654,0
"208","Frits T. Bülov"," Justitsminister "," (V)",1910-07-05,1913-06-21,"Regeringen-Berntsen",1910-07-05,1913-06-21,2.96164383561654,0
"209","J. Jensen-Sønderup"," Indenrigsminister "," (V)",1910-07-05,1913-06-21,"Regeringen-Berntsen",1910-07-05,1913-06-21,2.96164383561654,0
"210","Thomas Larsen"," Minister for offentlige arbejder "," (V)",1910-07-05,1913-06-21,"Regeringen-Berntsen",1910-07-05,1913-06-21,2.96164383561654,0
"211","Anders Nielsen"," Landbrugsminister "," (V)",1910-07-05,1913-06-21,"Regeringen-Berntsen",1910-07-05,1913-06-21,2.96164383561654,0
"212","Oscar B. Muus"," Minister for handel og søfart "," (V)",1910-07-05,1913-06-21,"Regeringen-Berntsen",1910-07-05,1913-06-21,2.96164383561654,0
"213","Bjørn Jonsson"," Minister for Island ",NA,1910-07-05,1911-03-14,"Regeringen-Berntsen",1910-07-05,1913-06-21,0.690410958904295,1
"214","Kristjan Jonsson"," Minister for Island ",NA,1910-07-05,1912-07-25,"Regeringen-Berntsen",1910-07-05,1913-06-21,2.05599221498619,1
"215","Hannes Hafstein"," Minister for Island",NA,1912-07-25,1913-06-21,"Regeringen-Berntsen",1910-07-05,1913-06-21,0.905651620630351,0
"216","C. Th. Zahle"," Konseilspræsident Fra 21.04.1918 Statsminister* "," (R)",1918-04-21,1920-03-29,"Regeringen-Zahle-II",1913-06-21,1920-03-29,1.93906729545643,0
"217","Edvard Brandes"," Udenrigsminister "," (R)",1913-06-21,1913-06-24,"Regeringen-Zahle-II",1913-06-21,1920-03-29,0.00821917808229955,1
"218","Erik Scavenius"," Udenrigsminister "," (R)",1913-06-24,1920-03-29,"Regeringen-Zahle-II",1913-06-21,1920-03-29,6.76372482970282,0
"219","Edvard Brandes"," Finansminister "," (R)",1913-06-21,1920-03-29,"Regeringen-Zahle-II",1913-06-21,1920-03-29,6.77194400778512,0
"220","Peter Munch"," Forsvarsminister "," (R)",1913-06-21,1920-03-29,"Regeringen-Zahle-II",1913-06-21,1920-03-29,6.77194400778512,0
"221","S. Keiser-Nielsen"," Kultusminister "," (R)",1913-06-21,1916-04-28,"Regeringen-Zahle-II",1913-06-21,1920-03-29,2.85391122089982,1
"222","Thorvald Povlsen"," Kirkeminister "," (R)",1916-04-28,1920-03-29,"Regeringen-Zahle-II",1913-06-21,1920-03-29,3.91803278688531,0
"223","S. Keiser-Nielsen"," Undervisningsminister "," (R)",1916-04-28,1920-03-29,"Regeringen-Zahle-II",1913-06-21,1920-03-29,3.91803278688531,0
"224","C. Th. Zahle"," Justitsminister "," (R)",1913-06-21,1920-03-29,"Regeringen-Zahle-II",1913-06-21,1920-03-29,6.77194400778512,0
"225","Ove Rode"," Indenrigsminister "," (R)",1913-06-21,1920-03-29,"Regeringen-Zahle-II",1913-06-21,1920-03-29,6.77194400778512,0
"226","J. Hassing- Jørgensen"," Minister for offentlige arbejder "," (R)",1913-06-21,1920-03-29,"Regeringen-Zahle-II",1913-06-21,1920-03-29,6.77194400778512,0
"227","Kristjan Pedersen"," Landbrugsminister "," (R)",1913-06-21,1920-03-29,"Regeringen-Zahle-II",1913-06-21,1920-03-29,6.77194400778512,0
"228","J. Hassing- Jørgensen"," Minister for handel og søfart Fra 1/4 1914 Handelsminister "," (R)",1913-06-21,1916-04-28,"Regeringen-Zahle-II",1913-06-21,1920-03-29,2.85391122089982,1
"229","J.C. Christensen"," Minister uden portefølje (30.09.1916 – 16.01.1918) "," (V)",1916-09-30,1918-01-16,"Regeringen-Zahle-II",1913-06-21,1920-03-29,1.29519425106673,1
"230","Chr. M. Rottbøll"," Minister uden portefølje (30.09.1916 – 16.01.1918) "," (KF)",1916-09-30,1918-01-16,"Regeringen-Zahle-II",1913-06-21,1920-03-29,1.29519425106673,1
"231","Th. Stauning"," Minister uden portefølje (fra 30.09.1916) "," (S)",1916-09-30,1920-03-29,"Regeringen-Zahle-II",1913-06-21,1920-03-29,3.49453551912575,0
"232","H.P. Hanssen (u.p.)"," Minister uden portefølje (30.09.1916 – 16.01.1918) "," (Nørremølle)",1916-09-30,1918-01-16,"Regeringen-Zahle-II",1913-06-21,1920-03-29,1.29519425106673,1
"233","Hannes Hafstein"," Minister for Island# ",NA,1913-06-21,1914-07-21,"Regeringen-Zahle-II",1913-06-21,1920-03-29,1.08219178082186,1
"234","Sigurdur Eggerz"," Minister for Island# ",NA,1913-06-21,1915-05-04,"Regeringen-Zahle-II",1913-06-21,1920-03-29,1.86849315068503,1
"235","Einar Arnorsson"," Minister for Island# ",NA,1913-06-21,1917-01-04,"Regeringen-Zahle-II",1913-06-21,1920-03-29,3.53972602739736,1
"236","Th. Stauning"," Socialminister"," (S)",1918-11-18,1920-03-29,"Regeringen-Zahle-II",1913-06-21,1920-03-29,1.3609851036756,0
"237","Otto Liebe"," Statsminister ",NA,1920-03-30,1920-04-05,"Regeringen-Liebe",1920-03-30,1920-04-05,0.016393442622757,0
"238","Henri Konow"," Udenrigsminister ",NA,1920-03-30,1920-04-05,"Regeringen-Liebe",1920-03-30,1920-04-05,0.016393442622757,0
"239","H.P. Hjerl Hansen"," Finansminister ",NA,1920-03-30,1920-04-05,"Regeringen-Liebe",1920-03-30,1920-04-05,0.016393442622757,0
"240","Henri Konow"," Forsvarsminister ",NA,1920-03-30,1920-04-05,"Regeringen-Liebe",1920-03-30,1920-04-05,0.016393442622757,0
"241","H. Edvard Hass"," Kirkeminister ",NA,1920-03-30,1920-04-05,"Regeringen-Liebe",1920-03-30,1920-04-05,0.016393442622757,0
"242","Thorkild Rovsing"," Undervisningsminister ",NA,1920-03-30,1920-04-05,"Regeringen-Liebe",1920-03-30,1920-04-05,0.016393442622757,0
"243","Otto Liebe"," Justitsminister til 02.04.1920 ",NA,1920-03-30,1920-04-02,"Regeringen-Liebe",1920-03-30,1920-04-05,0.0081967213113785,1
"244","Kristian Sindballe"," Justitsminister fra 02.04.1920 ",NA,1920-04-02,1920-04-05,"Regeringen-Liebe",1920-03-30,1920-04-05,0.0081967213113785,0
"245","W. Oxholm"," Indenrigsminister ",NA,1920-03-30,1920-04-05,"Regeringen-Liebe",1920-03-30,1920-04-05,0.016393442622757,0
"246","N.C. Monberg"," Minister for offentlige arbejder ",NA,1920-03-30,1920-04-05,"Regeringen-Liebe",1920-03-30,1920-04-05,0.016393442622757,0
"247","W. Oxholm"," Landbrugsminister ",NA,1920-03-30,1920-04-05,"Regeringen-Liebe",1920-03-30,1920-04-05,0.016393442622757,0
"248","M.N. Suenson"," Handelsminister",NA,1920-03-30,1920-04-05,"Regeringen-Liebe",1920-03-30,1920-04-05,0.016393442622757,0
"249","M. P. Friis"," Statsminister ",NA,1920-04-05,1920-05-05,"Regeringen-Friis",1920-04-05,1920-05-05,0.0819672131149218,0
"250","O. C. Scavenius"," Udenrigsminister ",NA,1920-04-05,1920-05-05,"Regeringen-Friis",1920-04-05,1920-05-05,0.0819672131149218,0
"251","A. M. Koefoed"," Finansminister ",NA,1920-04-05,1920-05-05,"Regeringen-Friis",1920-04-05,1920-05-05,0.0819672131149218,0
"252","M. P. Friis"," Forsvarsminister ",NA,1920-04-05,1920-05-05,"Regeringen-Friis",1920-04-05,1920-05-05,0.0819672131149218,0
"253","C. E. A. Ammentorp"," Kirkeminister ",NA,1920-04-05,1920-05-05,"Regeringen-Friis",1920-04-05,1920-05-05,0.0819672131149218,0
"254","P. J. Pedersen"," Undervisningsminister ",NA,1920-04-05,1920-05-05,"Regeringen-Friis",1920-04-05,1920-05-05,0.0819672131149218,0
"255","F. Schrøder"," Justitsminister ",NA,1920-04-05,1920-05-05,"Regeringen-Friis",1920-04-05,1920-05-05,0.0819672131149218,0
"256","H. Vedel"," Indenrigsminister ",NA,1920-04-05,1920-05-05,"Regeringen-Friis",1920-04-05,1920-05-05,0.0819672131149218,0
"257","K. Riis-Hansen"," Minister for offentlige arbejder ",NA,1920-04-05,1920-05-05,"Regeringen-Friis",1920-04-05,1920-05-05,0.0819672131149218,0
"258","Chr. Sonne"," Landbrugsminister ",NA,1920-04-05,1920-05-05,"Regeringen-Friis",1920-04-05,1920-05-05,0.0819672131149218,0
"259","H. P. Prior"," Handelsminister ",NA,1920-04-05,1920-05-05,"Regeringen-Friis",1920-04-05,1920-05-05,0.0819672131149218,0
"260","J. Jensen"," Socialminister",NA,1920-04-05,1920-05-05,"Regeringen-Friis",1920-04-05,1920-05-05,0.0819672131149218,0
"261","N. Neergaard"," Statsminister "," (V)",1920-05-05,1922-10-09,"Regeringen-Neergaard-II",1920-05-05,1922-10-09,2.42833295905371,0
"262","Harald Scavenius"," Udenrigsminister "," (u.p.)",1920-05-05,1922-10-09,"Regeringen-Neergaard-II",1920-05-05,1922-10-09,2.42833295905371,0
"263","N. Neergaard"," Finansminister "," (V)",1920-05-05,1922-10-09,"Regeringen-Neergaard-II",1920-05-05,1922-10-09,2.42833295905371,0
"264","Klaus Berntsen"," Forsvarsminister "," (V)",1920-05-05,1922-10-09,"Regeringen-Neergaard-II",1920-05-05,1922-10-09,2.42833295905371,0
"265","J. C. Christensen"," Kirkeminister til 15.08.1922 "," (V)",1920-05-05,1922-08-15,"Regeringen-Neergaard-II",1920-05-05,1922-10-09,2.277648027547,1
"266","Jacob Appel"," Kirkeminister fra 15.08.1922 "," (V)",1922-08-15,1922-10-09,"Regeringen-Neergaard-II",1920-05-05,1922-10-09,0.150684931506703,0
"267","Jacob Appel"," Undervisnings¬minister "," (V)",1920-05-05,1922-10-09,"Regeringen-Neergaard-II",1920-05-05,1922-10-09,2.42833295905371,0
"268","Svenning Rytter"," Justitsminister "," (V)",1920-05-05,1922-10-09,"Regeringen-Neergaard-II",1920-05-05,1922-10-09,2.42833295905371,0
"269","Sigurd Berg"," † 11.07.1921 "," (V)",1920-05-05,1921-07-11,"Regeringen-Neergaard-II",1920-05-05,1922-10-09,1.1817576165879,1
"270","Oluf Kragh"," Indenrigsminister fra 18.07.1921 "," (V)",1921-07-18,1922-10-09,"Regeringen-Neergaard-II",1920-05-05,1922-10-09,1.22739726027385,0
"271","M. N. Slebsager"," Minister for offentlige arbejder "," (V)",1920-05-05,1922-10-09,"Regeringen-Neergaard-II",1920-05-05,1922-10-09,2.42833295905371,0
"272","Th. Madsen-Mygdal"," Landbrugsminister "," (V)",1920-05-05,1922-10-09,"Regeringen-Neergaard-II",1920-05-05,1922-10-09,2.42833295905371,0
"273","Tyge J JRothe"," Handelsminister"," (V)",1920-05-05,1922-10-09,"Regeringen-Neergaard-II",1920-05-05,1922-10-09,2.42833295905371,0
"274","N. Neergaard"," Statsminister "," (V)",1922-10-09,1924-04-23,"Regeringen-neergaard-iii",1922-10-09,1924-04-23,1.53888015570033,0
"275","C. M. T. Cold"," Udenrigsminister ","(u.p.)",1922-10-09,1924-04-23,"Regeringen-neergaard-iii",1922-10-09,1924-04-23,1.53888015570033,0
"276","Jacob Appel"," Kirkeminister "," (V)",1922-10-09,1924-04-23,"Regeringen-neergaard-iii",1922-10-09,1924-04-23,1.53888015570033,0
"277","Jacob Appel"," Undervisningsminister "," (V)",1922-10-09,1924-04-23,"Regeringen-neergaard-iii",1922-10-09,1924-04-23,1.53888015570033,0
"278","Svenning Rytter"," Justitsminister "," (V)",1922-10-09,1924-04-23,"Regeringen-neergaard-iii",1922-10-09,1924-04-23,1.53888015570033,0
"279","Oluf Kragh"," Indenrigsminister "," (V)",1922-10-09,1924-04-23,"Regeringen-neergaard-iii",1922-10-09,1924-04-23,1.53888015570033,0
"280","M. N. Slebsager"," Minister for offentlige arbejder "," (V)",1922-10-09,1924-04-23,"Regeringen-neergaard-iii",1922-10-09,1924-04-23,1.53888015570033,0
"281","Th. Madsen-Mygdal"," Landbrugsminister "," (V)",1922-10-09,1924-04-23,"Regeringen-neergaard-iii",1922-10-09,1924-04-23,1.53888015570033,0
"282","Oluf Kragh"," ad interim til 10.10.1922 Handelsminister "," (V)",1922-10-09,1922-10-10,"Regeringen-neergaard-iii",1922-10-09,1924-04-23,0.00273972602735739,1
"283","Jørgen Christensen"," fra 10.10.1922 Handelsminister "," (V)",1922-10-10,1924-04-23,"Regeringen-neergaard-iii",1922-10-09,1924-04-23,1.53614042967297,0
"284","Klaus Berntsen"," fra 16.10.1922 Minister uden portefølje"," (V)",1922-10-16,1924-04-23,"Regeringen-neergaard-iii",1922-10-09,1924-04-23,1.5197020735086,0
"285","Th. Stauning"," Statsminister "," (S)",1924-04-23,1926-12-14,"Regeringen-Stauning-I",1924-04-23,1926-12-14,2.64194176210799,0
"286","Carl Moltke"," Udenrigsminister "," (u.p.)",1924-04-23,1926-12-14,"Regeringen-Stauning-I",1924-04-23,1926-12-14,2.64194176210799,0
"287","C. V. Bramsnæs"," Finansminister "," (S)",1924-04-23,1926-12-14,"Regeringen-Stauning-I",1924-04-23,1926-12-14,2.64194176210799,0
"288","L. Rasmussen"," Forsvarsminister "," (S)",1924-04-23,1926-12-14,"Regeringen-Stauning-I",1924-04-23,1926-12-14,2.64194176210799,0
"289","Peter Dahl"," Kirkeminister "," (S)",1924-04-23,1926-12-14,"Regeringen-Stauning-I",1924-04-23,1926-12-14,2.64194176210799,0
"290","Nina Bang"," Undervisningsminister "," (S)",1924-04-23,1926-12-14,"Regeringen-Stauning-I",1924-04-23,1926-12-14,2.64194176210799,0
"291","K. K. Steincke"," Justitsminister "," (S)",1924-04-23,1926-12-14,"Regeringen-Stauning-I",1924-04-23,1926-12-14,2.64194176210799,0
"292","C. N. Hauge"," Indenrigsminister "," (S)",1924-04-23,1926-12-14,"Regeringen-Stauning-I",1924-04-23,1926-12-14,2.64194176210799,0
"293","J. Friis-Skotte"," Minister for offentlige arbejder "," (S)",1924-04-23,1926-12-14,"Regeringen-Stauning-I",1924-04-23,1926-12-14,2.64194176210799,0
"294","Kristen Bording"," Landbrugsminister "," (S)",1924-04-23,1926-12-14,"Regeringen-Stauning-I",1924-04-23,1926-12-14,2.64194176210799,0
"295","Th. Stauning"," Minister for industri handel og søfart "," (S)",1924-04-23,1926-12-14,"Regeringen-Stauning-I",1924-04-23,1926-12-14,2.64194176210799,0
"296","Frederik Borgbjerg"," Socialminister"," (S)",1924-04-23,1926-12-14,"Regeringen-Stauning-I",1924-04-23,1926-12-14,2.64194176210799,0
"297","Th. Madsen-Mygdal"," Statsminister "," (V)",1926-12-14,1929-04-30,"Regeringen-Madsen-Mygdal",1926-12-14,1929-04-30,2.37534246575342,0
"298","L. Moltesen"," Udenrigsminister "," (V)",1926-12-14,1929-04-30,"Regeringen-Madsen-Mygdal",1926-12-14,1929-04-30,2.37534246575342,0
"299","N. Neergaard"," Finansminister "," (V)",1926-12-14,1929-04-30,"Regeringen-Madsen-Mygdal",1926-12-14,1929-04-30,2.37534246575342,0
"300","Søren Brorsen"," Forsvarsminister "," (V)",1926-12-14,1929-04-30,"Regeringen-Madsen-Mygdal",1926-12-14,1929-04-30,2.37534246575342,0
"301","Fr. Bruun-Rasmussen"," Kirkeminister "," (V)",1926-12-14,1929-04-30,"Regeringen-Madsen-Mygdal",1926-12-14,1929-04-30,2.37534246575342,0
"302","J. Byskov"," Undervisningsminister "," (V)",1926-12-14,1929-04-30,"Regeringen-Madsen-Mygdal",1926-12-14,1929-04-30,2.37534246575342,0
"303","Svenning Rytter"," Justitsminister "," (V)",1926-12-14,1929-04-30,"Regeringen-Madsen-Mygdal",1926-12-14,1929-04-30,2.37534246575342,0
"304","Oluf Kragh"," Indenrigsminister "," (V)",1926-12-14,1929-04-30,"Regeringen-Madsen-Mygdal",1926-12-14,1929-04-30,2.37534246575342,0
"305","Johannes Stensballe"," Minister for offentlige arbejder "," (V)",1926-12-14,1929-04-30,"Regeringen-Madsen-Mygdal",1926-12-14,1929-04-30,2.37534246575342,0
"306","Th. Madsen-Mygdal"," Landbrugsminister "," (V)",1926-12-14,1929-04-30,"Regeringen-Madsen-Mygdal",1926-12-14,1929-04-30,2.37534246575342,0
"307","V. Rubow"," Minister for sundhedsvæsen"," (V)",1926-12-14,1929-04-30,"Regeringen-Madsen-Mygdal",1926-12-14,1929-04-30,2.37534246575342,0
"308","Th. Stauning"," Statsminister "," (S)",1929-04-30,1935-11-04,"Regeringen-Stauning-II",1929-04-30,1935-11-04,6.51506849315069,0
"309","E Munch"," Udenrigsminister "," (R)",1929-04-30,1935-11-04,"Regeringen-Stauning-II",1929-04-30,1935-11-04,6.51506849315069,0
"310","C. V. Bramsnæs"," Finansminister til 31.05. 1933 "," (S)",1929-04-30,1933-05-31,"Regeringen-Stauning-II",1929-04-30,1935-11-04,4.08493150684922,1
"311","H.P. Hansen"," Finansminister fra 31.05. 1933 "," (S)",1933-05-31,1935-11-04,"Regeringen-Stauning-II",1929-04-30,1935-11-04,2.43013698630148,0
"312","L. Rasmussen"," Forsvarsminister til 24.11.1932 ","(S)",1929-04-30,1932-11-24,"Regeringen-Stauning-II",1929-04-30,1935-11-04,3.57014746612776,1
"313","H. P. Hansen"," Forsvarsminister fra 24.11.1932 til 31.05.1933 "," (S)",1932-11-24,1933-05-31,"Regeringen-Stauning-II",1929-04-30,1935-11-04,0.514784040721452,1
"314","Th. Stauning"," Forsvarsminister fra 31.05.1933 "," (S)",1933-05-31,1935-11-04,"Regeringen-Stauning-II",1929-04-30,1935-11-04,2.43013698630148,0
"315","Peter Dahl"," Kirkeminister "," (S)",1929-04-30,1935-11-04,"Regeringen-Stauning-II",1929-04-30,1935-11-04,6.51506849315069,0
"316","Frederik Borgbjerg"," Undervisningsminister "," (S)",1929-04-30,1935-11-04,"Regeringen-Stauning-II",1929-04-30,1935-11-04,6.51506849315069,0
"317","C. Th. Zahle"," Justitsminister "," (R)",1929-04-30,1935-11-04,"Regeringen-Stauning-II",1929-04-30,1935-11-04,6.51506849315069,0
"318","Bertel Dahlgaard"," Indenrigsminister "," (R)",1929-04-30,1935-11-04,"Regeringen-Stauning-II",1929-04-30,1935-11-04,6.51506849315069,0
"319","J. Friis-Skotte"," Minister for offentlige arbejder "," (S)",1929-04-30,1935-11-04,"Regeringen-Stauning-II",1929-04-30,1935-11-04,6.51506849315069,0
"320","Kristen Bording"," Landbrugsminister "," (S)",1929-04-30,1935-11-04,"Regeringen-Stauning-II",1929-04-30,1935-11-04,6.51506849315069,0
"321","C.N.Hauge"," Minister for industri og handel "," (S)",1929-04-30,1935-11-04,"Regeringen-Stauning-II",1929-04-30,1935-11-04,6.51506849315069,0
"322","Th. Stauning"," Minister for søfart og fiskeri til 31.05.1933 "," (S)",1929-04-30,1933-05-31,"Regeringen-Stauning-II",1929-04-30,1935-11-04,4.08493150684922,1
"323","C. N. Hauge"," Minister for søfart og fiskeri ad interim "," (S)",1929-04-30,1935-11-04,"Regeringen-Stauning-II",1929-04-30,1935-11-04,6.51506849315069,0
"324","K. K. Steincke"," Socialminister"," (S)",1929-04-30,1935-11-04,"Regeringen-Stauning-II",1929-04-30,1935-11-04,6.51506849315069,0
"325","Th. Stauning"," Statsminister "," (S)",1935-11-04,1939-09-15,"Regeringen-Stauning-III",1935-11-04,1939-09-15,3.86301369863008,0
"326","P. Munch"," Udenrigsminister "," (R)",1935-11-04,1939-09-15,"Regeringen-Stauning-III",1935-11-04,1939-09-15,3.86301369863008,0
"327","H. P. Hansen"," Finansminister til 20.07.1937 "," (S)",1935-11-04,1937-07-20,"Regeringen-Stauning-III",1935-11-04,1939-09-15,1.70684931506844,1
"328","Vilhelm Buhl"," Finansminister fra 20.07.1937 "," (S)",1937-07-20,1939-09-15,"Regeringen-Stauning-III",1935-11-04,1939-09-15,2.15616438356165,0
"329","Alsing Andersen","Forsvarsminister "," (S)",1935-11-04,1939-09-15,"Regeringen-Stauning-III",1935-11-04,1939-09-15,3.86301369863008,0
"330","Johannes Hansen"," Kirkeminister "," (S)",1935-11-04,1939-09-15,"Regeringen-Stauning-III",1935-11-04,1939-09-15,3.86301369863008,0
"331","Jørgen Jørgensen"," Undervisningsminister "," (R)",1935-11-04,1939-09-15,"Regeringen-Stauning-III",1935-11-04,1939-09-15,3.86301369863008,0
"332","K. K. Steincke"," Justitsminister "," (S)",1935-11-04,1939-09-15,"Regeringen-Stauning-III",1935-11-04,1939-09-15,3.86301369863008,0
"333","Bertel Dahlgaard"," Indenrigsminister "," (R)",1935-11-04,1939-09-15,"Regeringen-Stauning-III",1935-11-04,1939-09-15,3.86301369863008,0
"334","N. Fisker"," Minister for offentlige arbejder "," (S)",1935-11-04,1939-09-15,"Regeringen-Stauning-III",1935-11-04,1939-09-15,3.86301369863008,0
"335","Kristen Bording"," Landbrugsminister fra 09.11.1935 Minister for landbrug og fiskeri "," (S)",1935-11-09,1939-09-15,"Regeringen-Stauning-III",1935-11-04,1939-09-15,3.84931506849307,0
"336","Ludvig Christensen"," Socialminister"," (S)",1935-11-04,1939-09-15,"Regeringen-Stauning-III",1935-11-04,1939-09-15,3.86301369863008,0
"337","Th. Stauning"," Statsminister "," (S)",1939-09-15,1940-04-10,"Regeringen-Stauning-IV",1939-09-15,1940-04-10,0.569114454674718,0
"338","P. Munch"," Udenrigsminister "," (R)",1939-09-15,1940-04-10,"Regeringen-Stauning-IV",1939-09-15,1940-04-10,0.569114454674718,0
"339","Vilhelm Buhl"," Finansminister "," (S)",1939-09-15,1940-04-10,"Regeringen-Stauning-IV",1939-09-15,1940-04-10,0.569114454674718,0
"340","Alsing Andersen"," Forsvarsminister "," (S)",1939-09-15,1940-04-10,"Regeringen-Stauning-IV",1939-09-15,1940-04-10,0.569114454674718,0
"341","Jørgen Jørgensen"," Undervisningsminister "," (R)",1939-09-15,1940-04-10,"Regeringen-Stauning-IV",1939-09-15,1940-04-10,0.569114454674718,0
"342","S. Unmack Larsen"," Justitsminister "," (S)",1939-09-15,1940-04-10,"Regeringen-Stauning-IV",1939-09-15,1940-04-10,0.569114454674718,0
"343","Axel Sørensen"," Minister for offentlige arbejder "," (S)",1939-09-15,1940-04-10,"Regeringen-Stauning-IV",1939-09-15,1940-04-10,0.569114454674718,0
"344","Kristen Bording"," Minister for landbrug og fiskeri "," (S)",1939-09-15,1940-04-10,"Regeringen-Stauning-IV",1939-09-15,1940-04-10,0.569114454674718,0
"345","Bertel Dalgaard"," Indenrigsminister "," (R)",1939-09-15,1940-04-10,"Regeringen-Stauning-IV",1939-09-15,1940-04-10,0.569114454674718,0
"346","Johs. Hansen"," Kirkeminister "," (S)",1939-09-15,1940-04-10,"Regeringen-Stauning-IV",1939-09-15,1940-04-10,0.569114454674718,0
"347","Ludvig Christensen"," Socialminister"," (S)",1939-09-15,1940-04-10,"Regeringen-Stauning-IV",1939-09-15,1940-04-10,0.569114454674718,0
"348","Th. Stauning"," Statsminister "," (S)",1940-04-10,1940-07-08,"Regeringen-Stauning-V",1940-04-10,1940-07-08,0.243169398907185,0
"349","Vilhelm Buhl"," Finansminister "," (S)",1940-04-10,1940-07-08,"Regeringen-Stauning-V",1940-04-10,1940-07-08,0.243169398907185,0
"350","Jørgen Jørgensen"," Undervisningsminister "," (R)",1940-04-10,1940-07-08,"Regeringen-Stauning-V",1940-04-10,1940-07-08,0.243169398907185,0
"351","Kristen Bording"," Minister for landbrug og fiskeri "," (S)",1940-04-10,1940-07-08,"Regeringen-Stauning-V",1940-04-10,1940-07-08,0.243169398907185,0
"352","Johs. Hansen"," Kirkeminister "," (S)",1940-04-10,1940-07-08,"Regeringen-Stauning-V",1940-04-10,1940-07-08,0.243169398907185,0
"353","P. Munch"," Udenrigsminister "," (R)",1940-04-10,1940-07-08,"Regeringen-Stauning-V",1940-04-10,1940-07-08,0.243169398907185,0
"354","Bertel Dalgaard"," Indenrigsminister "," (R)",1940-04-10,1940-07-08,"Regeringen-Stauning-V",1940-04-10,1940-07-08,0.243169398907185,0
"355","Aksel Sørensen"," Trafikminister "," (S)",1940-04-10,1940-07-08,"Regeringen-Stauning-V",1940-04-10,1940-07-08,0.243169398907185,0
"356","Ludvig Christensen"," Socialminister "," (S)",1940-04-10,1940-07-08,"Regeringen-Stauning-V",1940-04-10,1940-07-08,0.243169398907185,0
"357","Alsing Andersen"," Forsvarsminister "," (S)",1940-04-10,1940-07-08,"Regeringen-Stauning-V",1940-04-10,1940-07-08,0.243169398907185,0
"358","S. Unmack Larsen"," Justitsminister "," (S)",1940-04-10,1940-07-08,"Regeringen-Stauning-V",1940-04-10,1940-07-08,0.243169398907185,0
"359","Søren Brorsen"," Minister uden portefølje "," (V)",1940-04-10,1940-07-08,"Regeringen-Stauning-V",1940-04-10,1940-07-08,0.243169398907185,0
"360","Oluf Krag"," Minister uden portefølje "," (V)",1940-04-10,1940-07-08,"Regeringen-Stauning-V",1940-04-10,1940-07-08,0.243169398907185,0
"361","Henrik Hauch"," Minister uden portefølje "," (V)",1940-04-10,1940-07-08,"Regeringen-Stauning-V",1940-04-10,1940-07-08,0.243169398907185,0
"362","Henning Hasle"," Minister uden portefølje "," (KF)",1940-04-10,1940-07-08,"Regeringen-Stauning-V",1940-04-10,1940-07-08,0.243169398907185,0
"363","J. Christmas Møller"," Minister uden portefølje "," (KF)",1940-04-10,1940-07-08,"Regeringen-Stauning-V",1940-04-10,1940-07-08,0.243169398907185,0
"364","Vilhelm Fibiger"," Minister uden portefølje"," (KF)",1940-04-10,1940-07-08,"Regeringen-Stauning-V",1940-04-10,1940-07-08,0.243169398907185,0
"365","Th. Stauning"," Statsminister † 03.05.1942 "," (S)",1940-07-08,1942-05-03,"Regeringen-Stauning-VI",1940-07-08,1942-05-04,1.81785313271939,1
"366","Erik Scavenius"," Udenrigsminister "," (u.p.)",1940-07-08,1942-05-04,"Regeringen-Stauning-VI",1940-07-08,1942-05-04,1.82059285874698,0
"367","Vilhelm Buhl"," Finansminister "," (S)",1940-07-08,1942-05-04,"Regeringen-Stauning-VI",1940-07-08,1942-05-04,1.82059285874698,0
"368","Søren Brorsen"," Forsvarsminister "," (V)",1940-07-08,1942-05-04,"Regeringen-Stauning-VI",1940-07-08,1942-05-04,1.82059285874698,0
"369","Vilhelm Fibiger"," Kirkeminister "," (KF)",1940-07-08,1942-05-04,"Regeringen-Stauning-VI",1940-07-08,1942-05-04,1.82059285874698,0
"370","Jørgen Jørgensen"," Undervisningsminister "," (R)",1940-07-08,1942-05-04,"Regeringen-Stauning-VI",1940-07-08,1942-05-04,1.82059285874698,0
"371","Harald Petersen"," Justitsminister til 09.07.1941 "," (u.p.)",1940-07-08,1941-07-09,"Regeringen-Stauning-VI",1940-07-08,1942-05-04,1.00141477655507,1
"372","E. ThuneJacobsen"," Justitsminister fra 09.07.1941 "," (u.p.)",1941-07-09,1942-05-04,"Regeringen-Stauning-VI",1940-07-08,1942-05-04,0.819178082191911,0
"373","Knud Kristensen"," Indenrigsminister "," (V)",1940-07-08,1942-05-04,"Regeringen-Stauning-VI",1940-07-08,1942-05-04,1.82059285874698,0
"374","Gunnar Larsen"," Minister for offentlige arbejder "," (u.p.)",1940-07-08,1942-05-04,"Regeringen-Stauning-VI",1940-07-08,1942-05-04,1.82059285874698,0
"375","Kristen Bording"," Minister for landbrug og fiskeri "," (S)",1940-07-08,1942-05-04,"Regeringen-Stauning-VI",1940-07-08,1942-05-04,1.82059285874698,0
"376","Johs. Kjærbøl"," Arbejds- og socialminister"," (S)",1940-07-08,1942-05-04,"Regeringen-Stauning-VI",1940-07-08,1942-05-04,1.82059285874698,0
"377","Vilhelm Buhl"," Statsminister "," (S)",1942-05-04,1942-11-09,"Regeringen-Buhl-I",1942-05-04,1942-11-09,0.51780821917805,0
"378","Erik Scavenius"," Udenrigsminister "," (u.p.)",1942-05-04,1942-11-09,"Regeringen-Buhl-I",1942-05-04,1942-11-09,0.51780821917805,0
"379","Vilhelm Buhl"," Finansminister "," (S)",1942-05-04,1942-07-16,"Regeringen-Buhl-I",1942-05-04,1942-11-09,0.199999999999818,1
"380","Alsing Andersen"," "," (S)",1942-07-16,1942-11-09,"Regeringen-Buhl-I",1942-05-04,1942-11-09,0.317808219178232,0
"381","Søren Brorsen"," Forsvarsminister "," (V)",1942-05-04,1942-11-09,"Regeringen-Buhl-I",1942-05-04,1942-11-09,0.51780821917805,0
"382","Vilhelm Fibiger"," Kirkeminister "," (KF)",1942-05-04,1942-11-09,"Regeringen-Buhl-I",1942-05-04,1942-11-09,0.51780821917805,0
"383","Jørgen Jørgensen"," Undervisningsminister "," (R)",1942-05-04,1942-11-09,"Regeringen-Buhl-I",1942-05-04,1942-11-09,0.51780821917805,0
"384","E. Thune Jacobsen"," Justitsminister "," (u.p.)",1942-05-04,1942-11-09,"Regeringen-Buhl-I",1942-05-04,1942-11-09,0.51780821917805,0
"385","Knud Kristensen"," Indenrigsminister "," (V)",1942-05-04,1942-11-09,"Regeringen-Buhl-I",1942-05-04,1942-11-09,0.51780821917805,0
"386","Gunnar Larsen"," Minister for offentlige arbejder "," (u.p.)",1942-05-04,1942-11-09,"Regeringen-Buhl-I",1942-05-04,1942-11-09,0.51780821917805,0
"387","Kristen Bording"," Minister for landbrug og fiskeri "," (S)",1942-05-04,1942-11-09,"Regeringen-Buhl-I",1942-05-04,1942-11-09,0.51780821917805,0
"388","Johs. Kjærbøl"," Arbejds- og socialminister"," (S)",1942-05-04,1942-11-09,"Regeringen-Buhl-I",1942-05-04,1942-11-09,0.51780821917805,0
"389","Erik Scavenius"," Statsminister "," (u.p.)",1942-11-09,1945-05-05,"Regeringen-Scavenius",1942-11-09,1945-05-05,2.48493150684931,0
"390","Erik Scavenius"," Udenrigsminister "," (u.p.)",1942-11-09,1945-05-05,"Regeringen-Scavenius",1942-11-09,1945-05-05,2.48493150684931,0
"391","K. H. Kofoed"," Finansminister "," (u.p.)",1942-11-09,1945-05-05,"Regeringen-Scavenius",1942-11-09,1945-05-05,2.48493150684931,0
"392","Søren Brorsen"," Forsvarsminister "," (V)",1942-11-09,1945-05-05,"Regeringen-Scavenius",1942-11-09,1945-05-05,2.48493150684931,0
"393","Valdemar Holbøll"," Kirkeminister "," (u.p.)",1942-11-09,1945-05-05,"Regeringen-Scavenius",1942-11-09,1945-05-05,2.48493150684931,0
"394","A. C. Højberg- Christensen"," Undervisningsminister "," (u.p.)",1942-11-09,1945-05-05,"Regeringen-Scavenius",1942-11-09,1945-05-05,2.48493150684931,0
"395","E. Thune Jacobsen"," Justitsminister "," (u.p.)",1942-11-09,1945-05-05,"Regeringen-Scavenius",1942-11-09,1945-05-05,2.48493150684931,0
"396","Jørgen Jørgensen"," Indenrigsminister "," (R)",1942-11-09,1945-05-05,"Regeringen-Scavenius",1942-11-09,1945-05-05,2.48493150684931,0
"397","Gunnar Larsen"," Minister for offentlige arbejder "," (u.p.)",1942-11-09,1945-05-05,"Regeringen-Scavenius",1942-11-09,1945-05-05,2.48493150684931,0
"398","N. Elgaard"," Trafikminister "," (V)",1942-11-09,1945-05-05,"Regeringen-Scavenius",1942-11-09,1945-05-05,2.48493150684931,0
"399","Kristen Bording"," Minister for landbrug og fiskeri "," (S)",1942-11-09,1945-05-05,"Regeringen-Scavenius",1942-11-09,1945-05-05,2.48493150684931,0
"400","Laurits Hansen"," Socialminister"," (S)",1942-11-09,1945-05-05,"Regeringen-Scavenius",1942-11-09,1945-05-05,2.48493150684931,0
"401","Vilhelm Buhl"," Statsminister "," (S)",1945-05-05,1945-11-07,"Regeringen-Buhl-II",1945-05-05,1945-11-07,0.509589041095751,0
"402","Vilhelm Buhl"," Udenrigsminister "," (S)",1945-05-05,1945-05-07,"Regeringen-Buhl-II",1945-05-05,1945-11-07,0.00547945205471478,1
"403","J. Christmas Møller"," Udenrigsminister "," (KF)",1945-05-07,1945-11-07,"Regeringen-Buhl-II",1945-05-05,1945-11-07,0.504109589041036,0
"404","H. C. Hansen"," Finansminister "," (S)",1945-05-05,1945-11-07,"Regeringen-Buhl-II",1945-05-05,1945-11-07,0.509589041095751,0
"405","Ole Bjørn Kraft"," Forsvarsminister "," (KF)",1945-05-05,1945-11-07,"Regeringen-Buhl-II",1945-05-05,1945-11-07,0.509589041095751,0
"406","Arne Sørensen"," Kirkeminister "," (DS)",1945-05-05,1945-11-07,"Regeringen-Buhl-II",1945-05-05,1945-11-07,0.509589041095751,0
"407","A. M. Hansen"," Undervisningsminister "," (R)",1945-05-05,1945-11-07,"Regeringen-Buhl-II",1945-05-05,1945-11-07,0.509589041095751,0
"408","N. Busch-Jensen"," Justitsminister "," (S)",1945-05-05,1945-11-07,"Regeringen-Buhl-II",1945-05-05,1945-11-07,0.509589041095751,0
"409","Knud Kristensen"," Indenrigsminister "," (V)",1945-05-05,1945-11-07,"Regeringen-Buhl-II",1945-05-05,1945-11-07,0.509589041095751,0
"410","Carl Petersen"," Minister for offentlige arbejder "," (S)",1945-05-05,1945-11-07,"Regeringen-Buhl-II",1945-05-05,1945-11-07,0.509589041095751,0
"411","Alfred Jensen"," Trafikminister "," (DKP)",1945-05-05,1945-11-07,"Regeringen-Buhl-II",1945-05-05,1945-11-07,0.509589041095751,0
"412","Erik Eriksen"," Landbrugsminister "," (V)",1945-05-05,1945-11-07,"Regeringen-Buhl-II",1945-05-05,1945-11-07,0.509589041095751,0
"413","Erik Eriksen"," Fiskeriminister "," (V)",1945-05-05,1945-11-07,"Regeringen-Buhl-II",1945-05-05,1945-11-07,0.509589041095751,0
"414","Hans Hedtoft"," Arbejds- og socialminister "," (S)",1945-05-05,1945-11-07,"Regeringen-Buhl-II",1945-05-05,1945-11-07,0.509589041095751,0
"415","Mogens Fog"," Minister for særlige anliggender "," (DKP)",1945-05-05,1945-11-07,"Regeringen-Buhl-II",1945-05-05,1945-11-07,0.509589041095751,0
"416","Aksel Larsen"," Minister uden portefølje "," (DKP)",1945-05-05,1945-11-07,"Regeringen-Buhl-II",1945-05-05,1945-11-07,0.509589041095751,0
"417","Frode Jakobsen"," Minister uden portefølje "," (S)",1945-05-05,1945-11-07,"Regeringen-Buhl-II",1945-05-05,1945-11-07,0.509589041095751,0
"418","Kr. Juul Christensen"," Minister uden portefølje "," (DS)",1945-05-05,1945-11-07,"Regeringen-Buhl-II",1945-05-05,1945-11-07,0.509589041095751,0
"419","Henrik Kauffmann"," Minister uden portefølje"," (u.p.)",1945-05-12,1945-11-07,"Regeringen-Buhl-II",1945-05-05,1945-11-07,0.490410958904022,0
"420","Knud Kristensen"," Statsminister "," (V)",1945-11-07,1947-11-13,"Regeringen-Knud-Kristensen",1945-11-07,1947-11-13,2.01643835616437,0
"421","Gustav Rasmussen"," Udenrigsminister "," (u.p.)",1945-11-07,1947-11-13,"Regeringen-Knud-Kristensen",1945-11-07,1947-11-13,2.01643835616437,0
"422","Thorkild Kristensen"," Finansminister "," (V)",1945-11-07,1947-11-13,"Regeringen-Knud-Kristensen",1945-11-07,1947-11-13,2.01643835616437,0
"423","Harald Petersen"," Forsvarsminister "," (V)",1945-11-07,1947-11-13,"Regeringen-Knud-Kristensen",1945-11-07,1947-11-13,2.01643835616437,0
"424","M. Hartling"," Kirkeminister "," (V)",1945-11-07,1945-11-12,"Regeringen-Knud-Kristensen",1945-11-07,1947-11-13,0.0136986301370143,1
"425","Carl Hermansen"," Kirkeminister "," (V)",1945-11-12,1947-11-13,"Regeringen-Knud-Kristensen",1945-11-07,1947-11-13,2.00273972602736,0
"426","M. Hartling"," Undervisningsminister "," (V)",1945-11-07,1947-11-13,"Regeringen-Knud-Kristensen",1945-11-07,1947-11-13,2.01643835616437,0
"427","A. L. H. Elmquist"," Justitsminister "," (V)",1945-11-07,1947-11-13,"Regeringen-Knud-Kristensen",1945-11-07,1947-11-13,2.01643835616437,0
"428","Ejnar Kjær"," Indenrigsminister "," (V)",1945-11-07,1947-06-18,"Regeringen-Knud-Kristensen",1945-11-07,1947-11-13,1.61095890410957,1
"429","N. Arnth-Jensen"," Indenrigsminister "," (V)",1947-06-30,1947-11-13,"Regeringen-Knud-Kristensen",1945-11-07,1947-11-13,0.372602739725835,0
"430","N. Elgaard"," Minister for offentlige arbejder "," (V)",1945-11-07,1947-11-13,"Regeringen-Knud-Kristensen",1945-11-07,1947-11-13,2.01643835616437,0
"431","Erik Eriksen"," Landbrugsminister "," (V)",1945-11-07,1947-11-13,"Regeringen-Knud-Kristensen",1945-11-07,1947-11-13,2.01643835616437,0
"432","Erik Eriksen"," Fiskeriminister "," (V)",1945-11-07,1947-11-13,"Regeringen-Knud-Kristensen",1945-11-07,1947-11-13,2.01643835616437,0
"433","Axel Kristensen"," Forsyningsminister "," (V)",1947-04-24,1947-11-13,"Regeringen-Knud-Kristensen",1945-11-07,1947-11-13,0.556164383561509,0
"434","Søren P. Larsen"," Arbejds- og socialminister "," (V)",1945-11-07,1947-04-24,"Regeringen-Knud-Kristensen",1945-11-07,1947-11-13,1.46027397260286,1
"435","Jens Sønderup"," Arbejds- og socialminister "," (V)",1947-04-24,1947-11-13,"Regeringen-Knud-Kristensen",1945-11-07,1947-11-13,0.556164383561509,0
"436","Per Federspiel"," Minister for særlige anliggender"," (V)",1945-11-07,1947-11-13,"Regeringen-Knud-Kristensen",1945-11-07,1947-11-13,2.01643835616437,0
"437","Hans Hedtoft"," Statsminister "," (A)",1947-11-13,1950-10-30,"Regeringen-Hedtoft-I",1947-11-13,1950-10-30,2.96164383561654,0
"438","Gustav Rasmussen"," Udenrigsminister "," (u.p.)",1947-11-13,1950-10-30,"Regeringen-Hedtoft-I",1947-11-13,1950-10-30,2.96164383561654,0
"439","H. C. Hansen"," Finansminister "," (A)",1947-11-13,1950-09-16,"Regeringen-Hedtoft-I",1947-11-13,1950-10-30,2.841095890411,1
"440","Viggo Kampmann"," Finansminister "," (A)",1950-09-16,1950-10-30,"Regeringen-Hedtoft-I",1947-11-13,1950-10-30,0.120547945205544,0
"441","Rasmus Hansen"," Forsvarsminister "," (A)",1947-11-13,1950-10-30,"Regeringen-Hedtoft-I",1947-11-13,1950-10-30,2.96164383561654,0
"442","Frede Nielsen"," Kirkeminister "," (A)",1947-11-13,1950-09-16,"Regeringen-Hedtoft-I",1947-11-13,1950-10-30,2.841095890411,1
"443","Bodil Koch"," Kirkeminister "," (A)",1950-09-16,1950-10-30,"Regeringen-Hedtoft-I",1947-11-13,1950-10-30,0.120547945205544,0
"444","Hartvig Frisch"," Undervisningsminister "," (A)",1947-11-13,1950-02-01,"Regeringen-Hedtoft-I",1947-11-13,1950-10-30,2.21917808219177,1
"445","Julius Bomholt"," Undervisningsminister "," (A)",1950-02-22,1950-10-30,"Regeringen-Hedtoft-I",1947-11-13,1950-10-30,0.684931506849352,0
"446","N. Busch-Jensen"," Justitsminister "," (A)",1947-11-13,1950-02-25,"Regeringen-Hedtoft-I",1947-11-13,1950-10-30,2.28493150684949,1
"447","Vilhelm Buhl"," Justitsminister "," (A)",1947-11-13,1950-03-04,"Regeringen-Hedtoft-I",1947-11-13,1950-10-30,2.30410958904122,1
"448","K. K. Steincke"," Justitsminister "," (A)",1950-03-04,1950-10-30,"Regeringen-Hedtoft-I",1947-11-13,1950-10-30,0.657534246575324,0
"449","Alsing Andersen"," Indenrigsminister "," (A)",1947-11-13,1947-11-23,"Regeringen-Hedtoft-I",1947-11-13,1950-10-30,0.0273972602740287,1
"450","Jens Smørum"," Indenrigsminister "," (A)",1947-11-23,1950-10-30,"Regeringen-Hedtoft-I",1947-11-13,1950-10-30,2.93424657534251,0
"451","Carl Petersen"," Minister for offentlige arbejder "," (A)",1947-11-13,1950-09-16,"Regeringen-Hedtoft-I",1947-11-13,1950-10-30,2.841095890411,1
"452","Frede Nielsen"," Minister for offentlige arbejder "," (A)",1950-09-16,1950-10-30,"Regeringen-Hedtoft-I",1947-11-13,1950-10-30,0.120547945205544,0
"453","Kristen Bording"," Landbrugsminister "," (A)",1947-11-13,1950-09-16,"Regeringen-Hedtoft-I",1947-11-13,1950-10-30,2.841095890411,1
"454","Carl Petersen"," Landbrugsminister "," (A)",1950-09-16,1950-10-30,"Regeringen-Hedtoft-I",1947-11-13,1950-10-30,0.120547945205544,0
"455","Chr. Christiansen"," Fiskeriminister "," (A)",1947-11-13,1950-10-30,"Regeringen-Hedtoft-I",1947-11-13,1950-10-30,2.96164383561654,0
"456","Johan Strøm"," Socialminister "," (A)",1947-11-13,1950-10-30,"Regeringen-Hedtoft-I",1947-11-13,1950-10-30,2.96164383561654,0
"457","Marius Sørensen"," Arbejdsminister "," (A)",1947-11-13,1949-11-23,"Regeringen-Hedtoft-I",1947-11-13,1950-10-30,2.02739726027403,1
"458","Johannes Kjærbøl"," Boligminister "," (A)",1947-11-23,1949-11-23,"Regeringen-Hedtoft-I",1947-11-13,1950-10-30,2,1
"459","Vilhelm Buhl"," Minister uden portefolje "," (A)",1947-11-13,1950-10-30,"Regeringen-Hedtoft-I",1947-11-13,1950-10-30,2.96164383561654,0
"460","Fanny Jensen"," Minister uden portefolje"," (A)",1947-11-13,1950-09-16,"Regeringen-Hedtoft-I",1947-11-13,1950-10-30,2.841095890411,1
"461","Hans Hedtoft"," Statsminister "," (A)",1950-09-16,1950-10-30,"Regeringen-Hedtoft-II",1950-09-16,1950-10-30,0.120547945205544,0
"462","Gustav Rasmussen"," Udenrigsminister "," (A)",1950-09-16,1950-10-30,"Regeringen-Hedtoft-II",1950-09-16,1950-10-30,0.120547945205544,0
"463","Viggo Kampmann"," Finansminister "," (A)",1950-09-16,1950-10-30,"Regeringen-Hedtoft-II",1950-09-16,1950-10-30,0.120547945205544,0
"464","Johannes Kjærbøl"," Arbejds- og boligminister "," (A)",1950-09-16,1950-10-30,"Regeringen-Hedtoft-II",1950-09-16,1950-10-30,0.120547945205544,0
"465","Frede Nielsen"," Minister for offentlige arbejder "," (A)",1950-09-16,1950-10-30,"Regeringen-Hedtoft-II",1950-09-16,1950-10-30,0.120547945205544,0
"466","Johan Strøm"," Socialminister "," (A)",1950-09-16,1950-10-30,"Regeringen-Hedtoft-II",1950-09-16,1950-10-30,0.120547945205544,0
"467","Christian Christiansen"," Fiskeriminister "," (A)",1950-09-16,1950-10-30,"Regeringen-Hedtoft-II",1950-09-16,1950-10-30,0.120547945205544,0
"468","Rasmus Hansen"," Forsvarsminister "," (A)",1950-09-16,1950-10-30,"Regeringen-Hedtoft-II",1950-09-16,1950-10-30,0.120547945205544,0
"469","Carl Petersen"," Landbrugsminister "," (A)",1950-09-16,1950-10-30,"Regeringen-Hedtoft-II",1950-09-16,1950-10-30,0.120547945205544,0
"470","Julius Bomholt"," Undervisningsminister "," (A)",1950-09-16,1950-10-30,"Regeringen-Hedtoft-II",1950-09-16,1950-10-30,0.120547945205544,0
"471","Bodil Koch"," Kirkeminister "," (A)",1950-09-16,1950-10-30,"Regeringen-Hedtoft-II",1950-09-16,1950-10-30,0.120547945205544,0
"472","K.K. Steincke"," Justitsminister "," (A)",1950-09-16,1950-10-30,"Regeringen-Hedtoft-II",1950-09-16,1950-10-30,0.120547945205544,0
"473","J.S. Smørum"," Indenrigsminister "," (A)",1950-09-16,1950-10-30,"Regeringen-Hedtoft-II",1950-09-16,1950-10-30,0.120547945205544,0
"474","V. Buhl"," Minister uden portefølje"," (A)",1950-09-16,1950-10-30,"Regeringen-Hedtoft-II",1950-09-16,1950-10-30,0.120547945205544,0
"475","Erik Eriksen"," Statsminister "," (V)",1950-10-30,1953-09-30,"Regeringen-Erik-Eriksen",1950-10-30,1953-09-30,2.91780821917814,0
"476","Ole Bjørn Kraft"," Udenrigsminister "," (C)",1950-10-30,1953-09-30,"Regeringen-Erik-Eriksen",1950-10-30,1953-09-30,2.91780821917814,0
"477","Thorkild Kristensen"," Finansminister "," (V)",1950-10-30,1953-09-30,"Regeringen-Erik-Eriksen",1950-10-30,1953-09-30,2.91780821917814,0
"478","Aksel Møller"," Indenrigs- og boligminister "," (C)",1950-10-30,1953-09-30,"Regeringen-Erik-Eriksen",1950-10-30,1953-09-30,2.91780821917814,0
"479","Helga Pedersen"," Justitsminister "," (V)",1950-10-30,1953-09-30,"Regeringen-Erik-Eriksen",1950-10-30,1953-09-30,2.91780821917814,0
"480","Flemming Hvidberg"," Undervisningsminister "," (C)",1950-10-30,1953-09-30,"Regeringen-Erik-Eriksen",1950-10-30,1953-09-30,2.91780821917814,0
"481","Jens Sønderup"," Kirkeminister "," (V)",1950-10-30,1951-09-13,"Regeringen-Erik-Eriksen",1950-10-30,1953-09-30,0.871232876712384,1
"482","Carl Hermansen"," Kirkeminister "," (V)",1951-09-13,1953-09-30,"Regeringen-Erik-Eriksen",1950-10-30,1953-09-30,2.04657534246576,0
"483","Harald Petersen"," Forsvarsminister "," (V)",1950-10-30,1953-09-30,"Regeringen-Erik-Eriksen",1950-10-30,1953-09-30,2.91780821917814,0
"484","Victor Larsen"," Minister for offentlige arbejder "," (C)",1950-10-30,1952-04-24,"Regeringen-Erik-Eriksen",1950-10-30,1953-09-30,1.48407814956204,1
"485","Jørgen Jørgensen"," Minister for offentlige arbejder "," (C)",1952-04-30,1953-09-30,"Regeringen-Erik-Eriksen",1950-10-30,1953-09-30,1.41733662699312,0
"486","Henrik A.R. Hauch"," Landbrugsminister "," (V)",1950-10-30,1951-09-13,"Regeringen-Erik-Eriksen",1950-10-30,1953-09-30,0.871232876712384,1
"487","Jens Sønderup"," Landbrugsminister "," (V)",1951-09-13,1953-09-30,"Regeringen-Erik-Eriksen",1950-10-30,1953-09-30,2.04657534246576,0
"488","Knud Rée"," Fiskeriminister "," (V)",1950-10-30,1953-09-30,"Regeringen-Erik-Eriksen",1950-10-30,1953-09-30,2.91780821917814,0
"489","Poul Sørensen"," Arbejds- og socialminister"," (C)",1950-10-30,1953-09-30,"Regeringen-Erik-Eriksen",1950-10-30,1953-09-30,2.91780821917814,0
"490","H.C. Hansen"," Udenrigsminister "," (A)",1953-09-30,1955-02-01,"Regeringen-Hedtoft-III",1953-09-30,1955-02-01,1.33972602739709,0
"491","Viggo Kampmann"," Finansminister "," (A)",1953-09-30,1955-02-01,"Regeringen-Hedtoft-III",1953-09-30,1955-02-01,1.33972602739709,0
"492","Johannes Kjærbøl"," Indenrigs- og boligminister "," (A)",1953-09-30,1955-02-01,"Regeringen-Hedtoft-III",1953-09-30,1955-02-01,1.33972602739709,0
"493","Carl Petersen"," Minister for offentlige arbejder "," (A)",1953-09-30,1955-02-01,"Regeringen-Hedtoft-III",1953-09-30,1955-02-01,1.33972602739709,0
"494","Christian Christiansen"," Fiskeriminister "," (A)",1953-09-30,1955-02-01,"Regeringen-Hedtoft-III",1953-09-30,1955-02-01,1.33972602739709,0
"495","Rasmus Hansen"," Forsvarsminister "," (A)",1953-09-30,1955-02-01,"Regeringen-Hedtoft-III",1953-09-30,1955-02-01,1.33972602739709,0
"496","J.S. Smørum"," Landbrugsminister "," (A)",1953-09-30,1955-02-01,"Regeringen-Hedtoft-III",1953-09-30,1955-02-01,1.33972602739709,0
"497","Jens Otto Krag"," Minister uden portefølje "," (A)",1953-11-01,1955-02-01,"Regeringen-Hedtoft-III",1953-09-30,1955-02-01,1.25205479452052,0
"498","Julius Bomholt"," Undervisningsminister "," (A)",1953-09-30,1955-02-01,"Regeringen-Hedtoft-III",1953-09-30,1955-02-01,1.33972602739709,0
"499","Bodil Koch"," Kirkeminister "," (A)",1953-09-30,1955-02-01,"Regeringen-Hedtoft-III",1953-09-30,1955-02-01,1.33972602739709,0
"500","Hans Hækkerup"," Justitsminister"," (A)",1953-09-30,1955-02-01,"Regeringen-Hedtoft-III",1953-09-30,1955-02-01,1.33972602739709,0
"501","H.C. Hansen"," Statsminister og udenrigsminister "," (A)",1955-02-01,1957-05-28,"Regeringen-hc-Hansen-I",1955-02-01,1957-05-28,2.31780821917823,0
"502","Viggo Kampmann"," Finansminister "," (A)",1955-02-01,1957-05-28,"Regeringen-hc-Hansen-I",1955-02-01,1957-05-28,2.31780821917823,0
"503","Carl Petersen"," Indenrigsminister "," (A)",1955-08-30,1957-05-28,"Regeringen-hc-Hansen-I",1955-02-01,1957-05-28,1.74246575342477,0
"504","Johan Strøm"," Socialminister "," (A)",1955-02-01,1957-05-28,"Regeringen-hc-Hansen-I",1955-02-01,1957-05-28,2.31780821917823,0
"505","Christian Christiansen"," Fiskeriminister "," (A)",1955-02-01,1957-05-28,"Regeringen-hc-Hansen-I",1955-02-01,1957-05-28,2.31780821917823,0
"506","Rasmus Hansen"," Forsvarsminister "," (A)",1955-02-01,1956-05-25,"Regeringen-hc-Hansen-I",1955-02-01,1957-05-28,1.31124335653885,1
"507","Poul Hansen"," Forsvarsminister "," (A)",1956-05-25,1957-05-28,"Regeringen-hc-Hansen-I",1955-02-01,1957-05-28,1.00656486263938,0
"508","J.S. Smørum"," Landbrugsminister "," (A)",1955-02-01,1957-05-28,"Regeringen-hc-Hansen-I",1955-02-01,1957-05-28,2.31780821917823,0
"509","Jens Otto Krag"," Økonomi- og arbejdsminister "," (A)",1955-02-01,1957-05-28,"Regeringen-hc-Hansen-I",1955-02-01,1957-05-28,2.31780821917823,0
"510","Julius Bomholt"," Undervisningsminister "," (A)",1955-02-01,1957-05-28,"Regeringen-hc-Hansen-I",1955-02-01,1957-05-28,2.31780821917823,0
"511","Bodil Koch"," Kirkeminister "," (A)",1955-02-01,1957-05-28,"Regeringen-hc-Hansen-I",1955-02-01,1957-05-28,2.31780821917823,0
"512","Hans Hækkerup"," Justitsminister "," (A)",1955-02-01,1957-05-28,"Regeringen-hc-Hansen-I",1955-02-01,1957-05-28,2.31780821917823,0
"513","Carl Petersen"," Minister for offentlige arbejder "," (A)",1955-02-01,1955-08-30,"Regeringen-hc-Hansen-I",1955-02-01,1957-05-28,0.575342465753465,1
"514","Kai Lindberg"," Minister for offentlige arbejder "," (A)",1955-08-30,1957-05-28,"Regeringen-hc-Hansen-I",1955-02-01,1957-05-28,1.74246575342477,0
"515","Ernst Christiansen"," Minister uden portefølje"," (A)",1955-08-30,1957-05-28,"Regeringen-hc-Hansen-I",1955-02-01,1957-05-28,1.74246575342477,0
"516","Viggo Kampmann"," Finansminister "," (A)",1957-05-28,1960-02-21,"Regeringen-hc-Hansen-II",1957-05-28,1960-02-21,2.73660453626758,0
"517","Jørgen Jørgensen"," Undervisningsminister "," (B)",1957-05-28,1960-02-21,"Regeringen-hc-Hansen-II",1957-05-28,1960-02-21,2.73660453626758,0
"518","Viggo Starcke"," Minister uden portefølje "," (E)",1957-05-28,1960-02-21,"Regeringen-hc-Hansen-II",1957-05-28,1960-02-21,2.73660453626758,0
"519","Bertel Dahlgaard"," Økonomiminister og minister for nordiske anliggender "," (B)",1957-05-28,1960-02-21,"Regeringen-hc-Hansen-II",1957-05-28,1960-02-21,2.73660453626758,0
"520","Julius Bomholt"," Socialminister "," (A)",1957-05-28,1960-02-21,"Regeringen-hc-Hansen-II",1957-05-28,1960-02-21,2.73660453626758,0
"521","Bodil Koch"," Kirkeminister "," (A)",1957-05-28,1960-02-21,"Regeringen-hc-Hansen-II",1957-05-28,1960-02-21,2.73660453626758,0
"522","Hans Hækkerup"," Justitsminister "," (A)",1957-05-28,1960-02-21,"Regeringen-hc-Hansen-II",1957-05-28,1960-02-21,2.73660453626758,0
"523","Kai Lindberg"," Minister for offentlige arbejder og for Grønland "," (A)",1957-05-28,1960-02-21,"Regeringen-hc-Hansen-II",1957-05-28,1960-02-21,2.73660453626758,0
"524","Poul Hansen"," Forsvarsminister "," (A)",1957-05-28,1960-02-21,"Regeringen-hc-Hansen-II",1957-05-28,1960-02-21,2.73660453626758,0
"525","Oluf Pedersen"," Fiskeriminister "," (E)",1957-05-28,1960-02-21,"Regeringen-hc-Hansen-II",1957-05-28,1960-02-21,2.73660453626758,0
"526","Kaj Bundvad"," Arbejds- og boligminister "," (A)",1957-05-28,1960-02-21,"Regeringen-hc-Hansen-II",1957-05-28,1960-02-21,2.73660453626758,0
"527","Karl Skytte"," Landbrugsminister "," (B)",1957-05-28,1960-02-21,"Regeringen-hc-Hansen-II",1957-05-28,1960-02-21,2.73660453626758,0
"528","Søren Olesen"," Indenrigsminister "," (E)",1957-05-28,1960-02-21,"Regeringen-hc-Hansen-II",1957-05-28,1960-02-21,2.73660453626758,0
"529","Jens Otto Krag"," Udenrigsminister "," (A)",1960-02-21,1960-11-18,"Regeringen-Viggo-Kampmann-I",1960-02-21,1960-11-18,0.740437158470058,0
"530","Kjeld Philip"," Finansminister "," (B)",1960-03-31,1960-11-18,"Regeringen-Viggo-Kampmann-I",1960-02-21,1960-11-18,0.633879781420774,0
"531","Jørgen Jørgensen"," Undervisningsminister "," (B)",1960-02-21,1960-11-18,"Regeringen-Viggo-Kampmann-I",1960-02-21,1960-11-18,0.740437158470058,0
"532","Viggo Starcke"," Minister uden portefølje "," (E)",1960-02-21,1960-11-18,"Regeringen-Viggo-Kampmann-I",1960-02-21,1960-11-18,0.740437158470058,0
"533","Bertel Dahlgaard"," Økonomiminister og minister for nordiske anliggender "," (B)",1960-02-21,1960-11-18,"Regeringen-Viggo-Kampmann-I",1960-02-21,1960-11-18,0.740437158470058,0
"534","Julius Bomholt"," Socialminister "," (A)",1960-02-21,1960-11-18,"Regeringen-Viggo-Kampmann-I",1960-02-21,1960-11-18,0.740437158470058,0
"535","Bodil Koch"," Kirkeminister "," (A)",1960-02-21,1960-11-18,"Regeringen-Viggo-Kampmann-I",1960-02-21,1960-11-18,0.740437158470058,0
"536","Hans Hækkerup"," Justitsminister "," (A)",1960-02-21,1960-11-18,"Regeringen-Viggo-Kampmann-I",1960-02-21,1960-11-18,0.740437158470058,0
"537","Kai Lindberg"," Minister for offentlige arbejder og for Grønland "," (A)",1960-02-21,1960-11-18,"Regeringen-Viggo-Kampmann-I",1960-02-21,1960-11-18,0.740437158470058,0
"538","Poul Hansen"," Forsvarsminister "," (A)",1960-02-21,1960-11-18,"Regeringen-Viggo-Kampmann-I",1960-02-21,1960-11-18,0.740437158470058,0
"539","Oluf Pedersen"," Fiskeriminister "," (E)",1960-02-21,1960-11-18,"Regeringen-Viggo-Kampmann-I",1960-02-21,1960-11-18,0.740437158470058,0
"540","Kaj Bundvad"," Arbejdsminister "," (A)",1960-02-21,1960-11-18,"Regeringen-Viggo-Kampmann-I",1960-02-21,1960-11-18,0.740437158470058,0
"541","Karl Skytte"," Landbrugsminister "," (B)",1960-02-21,1960-11-18,"Regeringen-Viggo-Kampmann-I",1960-02-21,1960-11-18,0.740437158470058,0
"542","Søren Olesen"," Indenrigsminister "," (E)",1960-02-21,1960-11-18,"Regeringen-Viggo-Kampmann-I",1960-02-21,1960-11-18,0.740437158470058,0
"543","Kaj Bundvad"," Boligminister "," (A)",1960-02-21,1960-03-31,"Regeringen-Viggo-Kampmann-I",1960-02-21,1960-11-18,0.106557377049285,1
"544","Carl P. Jensen"," Boligminister"," (A)",1960-03-31,1960-11-18,"Regeringen-Viggo-Kampmann-I",1960-02-21,1960-11-18,0.633879781420774,0
"545","Viggo Kampmann"," Statsminister "," (A)",1960-11-18,1962-09-03,"Regeringen-Viggo-Kampmann-II",1960-11-18,1962-09-03,1.79145145594725,0
"546","Jens Otto Krag"," Udenrigsminister "," (A)",1960-11-18,1962-09-03,"Regeringen-Viggo-Kampmann-II",1960-11-18,1962-09-03,1.79145145594725,0
"547","Jørgen Jørgensen"," Undervisningsminister "," (B)",1960-11-18,1961-09-07,"Regeringen-Viggo-Kampmann-II",1960-11-18,1962-09-03,0.802410360056911,1
"548","K. Helveg Petersen"," Undervisningsminister "," (B)",1961-09-07,1962-09-03,"Regeringen-Viggo-Kampmann-II",1960-11-18,1962-09-03,0.989041095890343,0
"549","Bertel Dahlgaard"," Økonomiminister "," (B)",1960-11-18,1961-09-07,"Regeringen-Viggo-Kampmann-II",1960-11-18,1962-09-03,0.802410360056911,1
"550","Kjeld Philip"," Økonomiminister "," (B)",1961-09-07,1962-09-03,"Regeringen-Viggo-Kampmann-II",1960-11-18,1962-09-03,0.989041095890343,0
"551","Julius Bomholt"," Socialminister "," (A)",1960-11-18,1961-09-07,"Regeringen-Viggo-Kampmann-II",1960-11-18,1962-09-03,0.802410360056911,1
"552","Kaj Bundvad"," Socialminister "," (A)",1961-09-07,1962-09-03,"Regeringen-Viggo-Kampmann-II",1960-11-18,1962-09-03,0.989041095890343,0
"553","Julius Bomholt"," Minister for kulturelle anliggender "," (A)",1961-09-07,1962-09-03,"Regeringen-Viggo-Kampmann-II",1960-11-18,1962-09-03,0.989041095890343,0
"554","Bodil Koch"," Kirkeminister "," (A)",1960-11-18,1962-09-03,"Regeringen-Viggo-Kampmann-II",1960-11-18,1962-09-03,1.79145145594725,0
"555","Hans Hækkerup"," Justitsminister "," (A)",1960-11-18,1962-09-03,"Regeringen-Viggo-Kampmann-II",1960-11-18,1962-09-03,1.79145145594725,0
"556","Kai Lindberg"," Minister for offentlige arbejder "," (A)",1960-11-18,1962-09-03,"Regeringen-Viggo-Kampmann-II",1960-11-18,1962-09-03,1.79145145594725,0
"557","Poul Hansen"," Forsvarsminister "," (A)",1960-11-18,1962-09-03,"Regeringen-Viggo-Kampmann-II",1960-11-18,1962-09-03,1.79145145594725,0
"558","Kaj Bundvad"," Arbejdsminister "," (A)",1960-11-18,1962-09-03,"Regeringen-Viggo-Kampmann-II",1960-11-18,1962-09-03,1.79145145594725,0
"559","Karl Skytte"," Landbrugsminister "," (B)",1960-11-18,1962-09-03,"Regeringen-Viggo-Kampmann-II",1960-11-18,1962-09-03,1.79145145594725,0
"560","Carl P. Jensen"," Boligminister "," (A)",1960-11-18,1962-09-03,"Regeringen-Viggo-Kampmann-II",1960-11-18,1962-09-03,1.79145145594725,0
"561","Hans R. Knudsen"," Indenrigsminister "," (A)",1960-11-18,1961-09-07,"Regeringen-Viggo-Kampmann-II",1960-11-18,1962-09-03,0.802410360056911,1
"562","Lars P. Jensen"," Indenrigsminister "," (A)",1961-09-07,1962-09-03,"Regeringen-Viggo-Kampmann-II",1960-11-18,1962-09-03,0.989041095890343,0
"563","A.C. Normann"," Fiskeriminister "," (B)",1960-11-18,1962-09-03,"Regeringen-Viggo-Kampmann-II",1960-11-18,1962-09-03,1.79145145594725,0
"564","Mikael Gam"," Minister for Grønland"," (u.p.)",1960-11-18,1962-09-03,"Regeringen-Viggo-Kampmann-II",1960-11-18,1962-09-03,1.79145145594725,0
"565","Jens Otto Krag"," Statsminister "," (A)",1962-09-03,1964-09-26,"Regeringen-Jens-Otto-Krag-I",1962-09-03,1964-09-26,2.06373980088324,0
"566","Per Hækkerup"," Udenrigsminister "," (A)",1962-09-03,1964-09-26,"Regeringen-Jens-Otto-Krag-I",1962-09-03,1964-09-26,2.06373980088324,0
"567","Hans R. Knudsen"," Finansminister "," (A)",1962-09-03,1962-11-04,"Regeringen-Jens-Otto-Krag-I",1962-09-03,1964-09-26,0.169863013698659,1
"568","Poul Hansen"," Finansminister (fra 15.11.1962) ",NA,1962-11-15,1964-09-26,"Regeringen-Jens-Otto-Krag-I",1962-09-03,1964-09-26,1.8637398008832,0
"569","Karl Skytte"," Landbrugsminister "," (B)",1962-09-03,1964-09-26,"Regeringen-Jens-Otto-Krag-I",1962-09-03,1964-09-26,2.06373980088324,0
"570","Julius Bomholt"," Minister for kulturelle anliggender "," (A)",1962-09-03,1964-09-26,"Regeringen-Jens-Otto-Krag-I",1962-09-03,1964-09-26,2.06373980088324,0
"571","Bodil Koch"," Kirkeminister "," (A)",1962-09-03,1964-09-26,"Regeringen-Jens-Otto-Krag-I",1962-09-03,1964-09-26,2.06373980088324,0
"572","Hans Hækkerup"," Justitsminister "," (A)",1962-09-03,1964-09-26,"Regeringen-Jens-Otto-Krag-I",1962-09-03,1964-09-26,2.06373980088324,0
"573","Kai Lindberg"," Minister for offentlige arbejder "," (A)",1962-09-03,1964-09-26,"Regeringen-Jens-Otto-Krag-I",1962-09-03,1964-09-26,2.06373980088324,0
"574","Kaj Bundvad"," Arbejds- og socialminister "," (A)",1963-08-27,1964-09-26,"Regeringen-Jens-Otto-Krag-I",1962-09-03,1964-09-26,1.08291788307497,0
"575","Kjeld Philip"," Økonomiminister "," (B)",1962-09-03,1964-09-26,"Regeringen-Jens-Otto-Krag-I",1962-09-03,1964-09-26,2.06373980088324,0
"576","Lars P. Jensen"," Indenrigsminister "," (A)",1962-09-03,1964-09-26,"Regeringen-Jens-Otto-Krag-I",1962-09-03,1964-09-26,2.06373980088324,0
"577","Carl P. Jensen"," Boligminister "," (A)",1962-09-03,1964-09-26,"Regeringen-Jens-Otto-Krag-I",1962-09-03,1964-09-26,2.06373980088324,0
"578","K. Helveg Petersen"," Undervisningsminister "," (B)",1962-09-03,1964-09-26,"Regeringen-Jens-Otto-Krag-I",1962-09-03,1964-09-26,2.06373980088324,0
"579","Poul Hansen"," Forsvarsminister "," (A)",1962-09-03,1962-11-15,"Regeringen-Jens-Otto-Krag-I",1962-09-03,1964-09-26,0.200000000000045,1
"580","Victor Gram"," Forsvarsminister "," (A)",1962-11-15,1964-09-26,"Regeringen-Jens-Otto-Krag-I",1962-09-03,1964-09-26,1.8637398008832,0
"581","Kaj Bundvad"," Arbejdsminister "," (A)",1962-09-03,1963-08-27,"Regeringen-Jens-Otto-Krag-I",1962-09-03,1964-09-26,0.980821917808271,1
"582","Erling Dinesen"," Arbejdsminister"," (A)",1963-08-27,1964-09-26,"Regeringen-Jens-Otto-Krag-I",1962-09-03,1964-09-26,1.08291788307497,0
"583","Jens Otto Krag"," Statsminister "," (A)",1964-09-26,1968-02-02,"Regeringen-Jens-Otto-Krag-II",1964-09-26,1968-02-02,3.3524590163936,0
"584","Per Hækkerup"," Udenrigsminister "," (A)",1964-09-26,1966-11-28,"Regeringen-Jens-Otto-Krag-II",1964-09-26,1968-02-02,2.17187663747291,1
"585","Jens Otto Krag"," Udenrigsminister "," (A)",1966-11-28,1967-10-01,"Regeringen-Jens-Otto-Krag-II",1964-09-26,1968-02-02,0.841095890410998,1
"586","Hans Tabor"," Udenrigsminister "," (A)",1967-10-01,1968-02-02,"Regeringen-Jens-Otto-Krag-II",1964-09-26,1968-02-02,0.339486488509692,0
"587","Poul Hansen"," Finansminister "," (A)",1964-09-26,1965-08-24,"Regeringen-Jens-Otto-Krag-II",1964-09-26,1968-02-02,0.908862938842731,1
"588","Henry Grünbaum"," Finansminister "," (A)",1965-08-24,1968-02-02,"Regeringen-Jens-Otto-Krag-II",1964-09-26,1968-02-02,2.44359607755086,0
"589","Poul Hansen"," Økonomiminister "," (A)",1964-09-26,1964-10-08,"Regeringen-Jens-Otto-Krag-II",1964-09-26,1968-02-02,0.0327868852459687,1
"590","Henry Grünbaum"," Økonomiminister "," (A)",1964-10-08,1965-08-24,"Regeringen-Jens-Otto-Krag-II",1964-09-26,1968-02-02,0.876076053596762,1
"591","Hans Hækkerup"," Indenrigsminister "," (A)",1964-09-26,1968-02-02,"Regeringen-Jens-Otto-Krag-II",1964-09-26,1968-02-02,3.3524590163936,0
"592","Kai Lindberg"," Minister for offentlige arbejder "," (A)",1964-09-26,1966-11-28,"Regeringen-Jens-Otto-Krag-II",1964-09-26,1968-02-02,2.17187663747291,1
"593","Svend Horn"," Minister for offentlige arbejder "," (A)",1966-11-28,1968-02-02,"Regeringen-Jens-Otto-Krag-II",1964-09-26,1968-02-02,1.18058237892069,0
"594","Lars P. Jensen"," Handelsminister "," (A)",1964-09-26,1966-09-21,"Regeringen-Jens-Otto-Krag-II",1964-09-26,1968-02-02,1.98557526760987,1
"595","Ove Hansen"," Handelsminister og minister for nordiske anliggender "," (A)",1967-10-01,1968-02-02,"Regeringen-Jens-Otto-Krag-II",1964-09-26,1968-02-02,0.339486488509692,0
"596","H. Larsen-Bjerre"," Fiskeriminister "," (A)",1964-09-26,1964-10-08,"Regeringen-Jens-Otto-Krag-II",1964-09-26,1968-02-02,0.0327868852459687,1
"597","Jens Risgaard Knudsen"," Fiskeriminister "," (A)",1964-10-08,1968-02-02,"Regeringen-Jens-Otto-Krag-II",1964-09-26,1968-02-02,3.31967213114763,0
"598","Kaj Bundvad"," Socialminister "," (A)",1964-09-26,1968-02-02,"Regeringen-Jens-Otto-Krag-II",1964-09-26,1968-02-02,3.3524590163936,0
"599","Carl P. Jensen"," Minister for Grønland "," (A)",1964-09-26,1968-02-02,"Regeringen-Jens-Otto-Krag-II",1964-09-26,1968-02-02,3.3524590163936,0
"600","Erling Dinesen"," Arbejdsminister "," (A)",1964-09-26,1968-02-02,"Regeringen-Jens-Otto-Krag-II",1964-09-26,1968-02-02,3.3524590163936,0
"601","Kaj Andresen"," Boligminister "," (A)",1964-09-26,1968-02-02,"Regeringen-Jens-Otto-Krag-II",1964-09-26,1968-02-02,3.3524590163936,0
"602","Victor Gram"," Forsvarsminister "," (A)",1964-09-26,1968-02-02,"Regeringen-Jens-Otto-Krag-II",1964-09-26,1968-02-02,3.3524590163936,0
"603","K. Axel Nielsen"," Justitsminister "," (A)",1964-09-26,1968-02-02,"Regeringen-Jens-Otto-Krag-II",1964-09-26,1968-02-02,3.3524590163936,0
"604","Chr. Thomsen"," Landbrugsminister "," (A)",1964-09-26,1968-02-02,"Regeringen-Jens-Otto-Krag-II",1964-09-26,1968-02-02,3.3524590163936,0
"605","K.B Andersen"," Undervisningsminister "," (A)",1964-09-26,1968-02-02,"Regeringen-Jens-Otto-Krag-II",1964-09-26,1968-02-02,3.3524590163936,0
"606","Bodil Koch"," Kirkeminister "," (A)",1964-09-26,1966-11-28,"Regeringen-Jens-Otto-Krag-II",1964-09-26,1968-02-02,2.17187663747291,1
"607","Orla Møller"," Kirkeminister "," (A)",1966-11-28,1968-02-02,"Regeringen-Jens-Otto-Krag-II",1964-09-26,1968-02-02,1.18058237892069,0
"608","Hans Sølvhøj"," Minister for kulturelle anliggender "," (A)",1964-09-26,1966-11-28,"Regeringen-Jens-Otto-Krag-II",1964-09-26,1968-02-02,2.17187663747291,1
"609","Bodil Koch"," Minister for kulturelle anliggender "," (A)",1966-11-28,1968-02-02,"Regeringen-Jens-Otto-Krag-II",1964-09-26,1968-02-02,1.18058237892069,0
"610","Camma Larsen-Ledet"," Minister for familiens anliggender * "," (A)",1966-11-28,1968-02-02,"Regeringen-Jens-Otto-Krag-II",1964-09-26,1968-02-02,1.18058237892069,0
"611","Hilmar Baunsgaard"," Statsminister "," (B)",1968-02-02,1971-10-11,"Regeringen-Hilmar-Baunsgaard",1968-02-02,1971-10-11,3.68791077176434,0
"612","Poul Hartling"," Udenrigsminister "," (V)",1968-02-02,1971-10-11,"Regeringen-Hilmar-Baunsgaard",1968-02-02,1971-10-11,3.68791077176434,0
"613","Poul Møller"," Finansminister "," (C)",1968-02-02,1971-03-17,"Regeringen-Hilmar-Baunsgaard",1968-02-02,1971-10-11,3.11804775806559,1
"614","Erik Ninn-Hansen"," Finansminister "," (C)",1971-03-17,1971-10-11,"Regeringen-Hilmar-Baunsgaard",1968-02-02,1971-10-11,0.56986301369875,0
"615","A.C. Normann"," Fiskeriminister og minister for Grønland "," (B)",1968-02-02,1971-10-11,"Regeringen-Hilmar-Baunsgaard",1968-02-02,1971-10-11,3.68791077176434,0
"616","K. Helveg Petersen"," Minister for kulturelle anliggender og minister for teknisk samarbejde med udviklingslandene samt nedrustningsspørgsmål "," (B)",1968-02-02,1971-10-11,"Regeringen-Hilmar-Baunsgaard",1968-02-02,1971-10-11,3.68791077176434,0
"617","Poul Sørensen"," Indenrigsminister "," (C)",1968-02-02,1969-06-29,"Regeringen-Hilmar-Baunsgaard",1968-02-02,1971-10-11,1.40297926491485,1
"618","H.C. Toft"," Indenrigsminister "," (C)",1969-07-11,1971-10-11,"Regeringen-Hilmar-Baunsgaard",1968-02-02,1971-10-11,2.25205479452075,0
"619","Knud Thestrup"," Justitsminister "," (C)",1968-02-02,1971-10-11,"Regeringen-Hilmar-Baunsgaard",1968-02-02,1971-10-11,3.68791077176434,0
"620","Erik Ninn-Hansen"," Forsvarsminister "," (C)",1968-02-02,1971-03-17,"Regeringen-Hilmar-Baunsgaard",1968-02-02,1971-10-11,3.11804775806559,1
"621","Knud Østergaard"," Forsvarsminister "," (C)",1971-03-17,1971-10-11,"Regeringen-Hilmar-Baunsgaard",1968-02-02,1971-10-11,0.56986301369875,0
"622","Peter Larsen"," Landbrugsminister "," (V)",1968-02-02,1970-07-07,"Regeringen-Hilmar-Baunsgaard",1968-02-02,1971-10-11,2.42489707313416,1
"623","Henry Christensen"," Landbrugsminister "," (V)",1970-07-14,1971-10-11,"Regeringen-Hilmar-Baunsgaard",1968-02-02,1971-10-11,1.24383561643845,0
"624","Ove Guldberg"," Minister for offentlige arbejder "," (V)",1968-02-02,1971-10-11,"Regeringen-Hilmar-Baunsgaard",1968-02-02,1971-10-11,3.68791077176434,0
"625","Aage Hastrup"," Boligminister "," (C)",1968-02-28,1971-10-11,"Regeringen-Hilmar-Baunsgaard",1968-02-02,1971-10-11,3.61687252039837,0
"626","Nathalie Lind"," Socialminister "," (V)",1968-02-02,1971-10-11,"Regeringen-Hilmar-Baunsgaard",1968-02-02,1971-10-11,3.68791077176434,0
"627","Helge Larsen"," Undervisningsminister "," (B)",1968-02-02,1971-10-11,"Regeringen-Hilmar-Baunsgaard",1968-02-02,1971-10-11,3.68791077176434,0
"628","Lauge Dahlgaard"," Arbejdsminister "," (B)",1968-02-02,1971-10-11,"Regeringen-Hilmar-Baunsgaard",1968-02-02,1971-10-11,3.68791077176434,0
"629","Poul Nyboe Andersen"," Økonomiminister og minister for nordiske anliggender samt europæiske markedsanliggender "," (V)",1968-02-02,1971-10-11,"Regeringen-Hilmar-Baunsgaard",1968-02-02,1971-10-11,3.68791077176434,0
"630","Arne Fog Pedersen"," Kirkeminister"," (V)",1968-02-02,1971-10-11,"Regeringen-Hilmar-Baunsgaard",1968-02-02,1971-10-11,3.68791077176434,0
"631","Jens Otto Krag"," Statsminister "," (A)",1971-10-11,1972-10-05,"Regeringen-Jens-Otto-Krag-III",1971-10-11,1972-10-05,0.984220375776431,0
"632","K.B Andersen"," Udenrigsminister "," (A)",1971-10-11,1972-10-05,"Regeringen-Jens-Otto-Krag-III",1971-10-11,1972-10-05,0.984220375776431,0
"633","Henry Grünbaum"," Finansminister "," (A)",1971-10-11,1972-10-05,"Regeringen-Jens-Otto-Krag-III",1971-10-11,1972-10-05,0.984220375776431,0
"634","Per Hækkerup"," Økonomi- og budgetminister "," (A)",1971-10-11,1972-10-05,"Regeringen-Jens-Otto-Krag-III",1971-10-11,1972-10-05,0.984220375776431,0
"635","Erling Dinesen"," Arbejdsminister "," (A)",1971-10-11,1972-10-05,"Regeringen-Jens-Otto-Krag-III",1971-10-11,1972-10-05,0.984220375776431,0
"636","K. Axel Nielsen"," Justitsminister "," (A)",1971-10-11,1972-10-05,"Regeringen-Jens-Otto-Krag-III",1971-10-11,1972-10-05,0.984220375776431,0
"637","Chr. Thomsen"," Fiskeriminister "," (A)",1971-10-11,1972-10-05,"Regeringen-Jens-Otto-Krag-III",1971-10-11,1972-10-05,0.984220375776431,0
"638","Helge Nielsen"," Boligminister "," (A)",1971-10-11,1972-10-05,"Regeringen-Jens-Otto-Krag-III",1971-10-11,1972-10-05,0.984220375776431,0
"639","Egon Jensen"," Indenrigsminister "," (A)",1971-10-11,1972-10-05,"Regeringen-Jens-Otto-Krag-III",1971-10-11,1972-10-05,0.984220375776431,0
"640","Niels Matthiasen"," Minister for kulturelle anliggender "," (A)",1971-10-11,1972-10-05,"Regeringen-Jens-Otto-Krag-III",1971-10-11,1972-10-05,0.984220375776431,0
"641","Knud Hertling"," Minister for Grønland "," (u.p.)",1971-10-11,1972-10-05,"Regeringen-Jens-Otto-Krag-III",1971-10-11,1972-10-05,0.984220375776431,0
"642","Kjeld Olesen"," Forsvarsminister "," (A)",1971-10-11,1972-10-05,"Regeringen-Jens-Otto-Krag-III",1971-10-11,1972-10-05,0.984220375776431,0
"643","Jens Kampmann"," Minister for offentlige arbejder og for forureningsbekæmpelse "," (A)",1971-10-11,1972-10-05,"Regeringen-Jens-Otto-Krag-III",1971-10-11,1972-10-05,0.984220375776431,0
"644","Eva Gredal"," Socialminister "," (A)",1971-10-11,1972-10-05,"Regeringen-Jens-Otto-Krag-III",1971-10-11,1972-10-05,0.984220375776431,0
"645","Knud Heinesen"," Undervisningsminister "," (A)",1971-10-11,1972-10-05,"Regeringen-Jens-Otto-Krag-III",1971-10-11,1972-10-05,0.984220375776431,0
"646","Ib Frederiksen"," Landbrugsminister "," (A)",1971-10-11,1972-10-05,"Regeringen-Jens-Otto-Krag-III",1971-10-11,1972-10-05,0.984220375776431,0
"647","Dorte Bennedsen"," Kirkeminister "," (A)",1971-10-11,1972-10-05,"Regeringen-Jens-Otto-Krag-III",1971-10-11,1972-10-05,0.984220375776431,0
"648","Anker Jørgensen"," Statsminister "," (A)",1972-10-05,1973-12-19,"Regeringen-Anker-Joergensen-I",1972-10-05,1973-12-19,1.20482072011396,0
"649","K.B Andersen"," Udenrigsminister "," (A)",1972-10-05,1973-12-19,"Regeringen-Anker-Joergensen-I",1972-10-05,1973-12-19,1.20482072011396,0
"650","Henry Grünbaum"," Finansminister "," (A)",1972-10-05,1973-12-19,"Regeringen-Anker-Joergensen-I",1972-10-05,1973-12-19,1.20482072011396,0
"651","Erling Dinesen"," Arbejdsminister "," (A)",1972-10-05,1973-12-19,"Regeringen-Anker-Joergensen-I",1972-10-05,1973-12-19,1.20482072011396,0
"652","K. Axel Nielsen"," Justitsminister "," (A)",1972-10-05,1973-09-27,"Regeringen-Anker-Joergensen-I",1972-10-05,1973-12-19,0.977423459839883,1
"653","Karl Hjortnæs"," Justitsminister "," (A)",1973-09-27,1973-12-19,"Regeringen-Anker-Joergensen-I",1972-10-05,1973-12-19,0.227397260274074,0
"654","Chr. Thomsen"," Fiskeriminister "," (A)",1972-10-05,1973-09-27,"Regeringen-Anker-Joergensen-I",1972-10-05,1973-12-19,0.977423459839883,1
"655","Ib Frederiksen"," Fiskeriminister "," (A)",1973-09-27,1973-12-19,"Regeringen-Anker-Joergensen-I",1972-10-05,1973-12-19,0.227397260274074,0
"656","Helge Nielsen"," Boligminister "," (A)",1972-10-05,1973-09-27,"Regeringen-Anker-Joergensen-I",1972-10-05,1973-12-19,0.977423459839883,1
"657","Svend Jakobsen"," Boligminister "," (A)",1973-09-27,1973-12-19,"Regeringen-Anker-Joergensen-I",1972-10-05,1973-12-19,0.227397260274074,0
"658","Egon Jensen"," Indenrigsminister "," (A)",1972-10-05,1973-12-19,"Regeringen-Anker-Joergensen-I",1972-10-05,1973-12-19,1.20482072011396,0
"659","Niels Matthiasen"," Minister for kulturelle anliggender "," (A)",1972-10-05,1973-12-19,"Regeringen-Anker-Joergensen-I",1972-10-05,1973-12-19,1.20482072011396,0
"660","Knud Hertling"," Minister for Grønland "," (u.p.)",1972-10-05,1973-12-19,"Regeringen-Anker-Joergensen-I",1972-10-05,1973-12-19,1.20482072011396,0
"661","Kjeld Olesen"," Forsvarsminister "," (A)",1972-10-05,1973-09-27,"Regeringen-Anker-Joergensen-I",1972-10-05,1973-12-19,0.977423459839883,1
"662","Orla Møller"," Forsvarsminister "," (A)",1973-09-27,1973-12-19,"Regeringen-Anker-Joergensen-I",1972-10-05,1973-12-19,0.227397260274074,0
"663","Eva Gredal"," Socialminister "," (A)",1972-10-05,1973-12-19,"Regeringen-Anker-Joergensen-I",1972-10-05,1973-12-19,1.20482072011396,0
"664","Knud Heinesen"," Undervisningsminister "," (A)",1972-10-05,1973-09-27,"Regeringen-Anker-Joergensen-I",1972-10-05,1973-12-19,0.977423459839883,1
"665","Ritt Bjerregaard"," Undervisningsminister "," (A)",1973-09-27,1973-12-19,"Regeringen-Anker-Joergensen-I",1972-10-05,1973-12-19,0.227397260274074,0
"666","Ib Frederiksen"," Landbrugsminister "," (A)",1973-09-27,1973-12-19,"Regeringen-Anker-Joergensen-I",1972-10-05,1973-12-19,0.227397260274074,0
"667","Dorte Bennedsen"," Kirkeminister "," (A)",1972-10-05,1973-12-19,"Regeringen-Anker-Joergensen-I",1972-10-05,1973-12-19,1.20482072011396,0
"668","Erling Jensen"," Handelsminister "," (A)",1972-10-05,1973-12-19,"Regeringen-Anker-Joergensen-I",1972-10-05,1973-12-19,1.20482072011396,0
"669","Knud Heinesen"," Budgetminister "," (A)",1973-09-27,1973-12-19,"Regeringen-Anker-Joergensen-I",1972-10-05,1973-12-19,0.227397260274074,0
"670","Helge Nielsen"," Miljøminister"," (A)",1973-09-27,1973-12-19,"Regeringen-Anker-Joergensen-I",1972-10-05,1973-12-19,0.227397260274074,0
"671","Poul Hartling"," Statsminister "," (V)",1973-12-19,1975-02-13,"Regeringen-Poul-Hartling",1973-12-19,1975-02-13,1.15342465753429,0
"672","Ove Guldberg"," Udenrigsminister "," (V)",1973-12-19,1975-02-13,"Regeringen-Poul-Hartling",1973-12-19,1975-02-13,1.15342465753429,0
"673","Anders Andersen"," Finansminister "," (V)",1973-12-19,1975-02-13,"Regeringen-Poul-Hartling",1973-12-19,1975-02-13,1.15342465753429,0
"674","Nathalie Lind"," Justitsminister og minister for kulturelle anliggender "," (V)",1973-12-19,1975-02-13,"Regeringen-Poul-Hartling",1973-12-19,1975-02-13,1.15342465753429,0
"675","Poul Nyboe Andersen"," Økonomi- og handelsminister "," (V)",1973-12-19,1975-02-13,"Regeringen-Poul-Hartling",1973-12-19,1975-02-13,1.15342465753429,0
"676","Kresten Damsgaard"," Kirkeminister og minister for offentlige arbejder"," (V)",1973-12-19,1975-02-13,"Regeringen-Poul-Hartling",1973-12-19,1975-02-13,1.15342465753429,0
"677","Holger Hansen"," Miljøminister og minister for Grønland "," (V)",1973-12-19,1975-02-13,"Regeringen-Poul-Hartling",1973-12-19,1975-02-13,1.15342465753429,0
"678","Johan Philipsen"," Arbejds- og boligminister "," (V)",1973-12-19,1975-02-13,"Regeringen-Poul-Hartling",1973-12-19,1975-02-13,1.15342465753429,0
"679","Jacob Sørensen"," Indenrigsminister og socialminister "," (V)",1973-12-19,1975-02-13,"Regeringen-Poul-Hartling",1973-12-19,1975-02-13,1.15342465753429,0
"680","Niels Anker Kofoed"," Landbrugs- og fiskeriminister "," (V)",1973-12-19,1975-02-13,"Regeringen-Poul-Hartling",1973-12-19,1975-02-13,1.15342465753429,0
"681","Tove Nielsen"," Undervisningsminister "," (V)",1973-12-19,1975-02-13,"Regeringen-Poul-Hartling",1973-12-19,1975-02-13,1.15342465753429,0
"682","Erling Brøndum"," Forsvarsminister"," (V)",1973-12-19,1975-02-13,"Regeringen-Poul-Hartling",1973-12-19,1975-02-13,1.15342465753429,0
"683","Anker Jørgensen"," Statsminister "," (A)",1975-02-13,1978-08-30,"Regeringen-Anker-Joergensen-II",1975-02-13,1978-08-30,3.54246575342449,0
"684","K.B Andersen"," Udenrigsminister "," (A)",1975-02-13,1978-07-01,"Regeringen-Anker-Joergensen-II",1975-02-13,1978-08-30,3.37808219178078,1
"685","Anker Jørgensen"," Udenrigsminister "," (A)",1978-07-01,1978-08-30,"Regeringen-Anker-Joergensen-II",1975-02-13,1978-08-30,0.164383561643717,0
"686","Knud Heinesen"," Finansminister "," (A)",1975-02-13,1978-08-30,"Regeringen-Anker-Joergensen-II",1975-02-13,1978-08-30,3.54246575342449,0
"687","Ivar Nørgaard"," Minister for udenrigsøkonomi og for nordiske anliggender "," (A)",1975-02-13,1977-02-26,"Regeringen-Anker-Joergensen-II",1975-02-13,1978-08-30,2.0356164383561,1
"688","Egon Jensen"," Indenrigsminister "," (A)",1975-02-13,1978-08-30,"Regeringen-Anker-Joergensen-II",1975-02-13,1978-08-30,3.54246575342449,0
"689","Svend Jakobsen"," Minister for skatter og afgifter "," (A)",1975-02-13,1977-02-26,"Regeringen-Anker-Joergensen-II",1975-02-13,1978-08-30,2.0356164383561,1
"690","Jens Kampmann"," Minister for skatter og afgifter "," (A)",1977-02-26,1978-08-30,"Regeringen-Anker-Joergensen-II",1975-02-13,1978-08-30,1.50684931506839,0
"691","Erling Dinesen"," Arbejdsminister "," (A)",1975-02-13,1976-09-08,"Regeringen-Anker-Joergensen-II",1975-02-13,1978-08-30,1.56798413054867,1
"692","Erling Jensen"," Arbejdsminister "," (A)",1976-09-08,1977-10-01,"Regeringen-Anker-Joergensen-II",1975-02-13,1978-08-30,1.06215285575263,1
"693","Svend Auken"," Arbejdsminister "," (A)",1977-10-01,1978-08-30,"Regeringen-Anker-Joergensen-II",1975-02-13,1978-08-30,0.912328767123199,0
"694","Orla Møller"," Justitsminister "," (A)",1975-02-13,1977-10-01,"Regeringen-Anker-Joergensen-II",1975-02-13,1978-08-30,2.6301369863013,1
"695","Erling Jensen"," Justitsminister "," (A)",1977-10-01,1978-08-30,"Regeringen-Anker-Joergensen-II",1975-02-13,1978-08-30,0.912328767123199,0
"696","Orla Møller"," Forsvarsminister "," (A)",1975-02-13,1977-10-01,"Regeringen-Anker-Joergensen-II",1975-02-13,1978-08-30,2.6301369863013,1
"697","Poul Søgaard"," Forsvarsminister "," (A)",1977-10-01,1978-08-30,"Regeringen-Anker-Joergensen-II",1975-02-13,1978-08-30,0.912328767123199,0
"698","Helge Nielsen"," Boligminister "," (A)",1975-02-13,1977-01-26,"Regeringen-Anker-Joergensen-II",1975-02-13,1978-08-30,1.95068493150666,1
"699","Svend Jakobsen"," Boligminister "," (A)",1977-01-26,1977-02-26,"Regeringen-Anker-Joergensen-II",1975-02-13,1978-08-30,0.0849315068494434,1
"700","Ove Hove"," Boligminister "," (A)",1977-02-26,1978-08-30,"Regeringen-Anker-Joergensen-II",1975-02-13,1978-08-30,1.50684931506839,0
"701","Helge Nielsen"," Miljøminister "," (A)",1975-02-13,1977-01-26,"Regeringen-Anker-Joergensen-II",1975-02-13,1978-08-30,1.95068493150666,1
"702","Svend Jakobsen"," Miljøminister "," (A)",1977-01-26,1977-02-26,"Regeringen-Anker-Joergensen-II",1975-02-13,1978-08-30,0.0849315068494434,1
"703","Niels Matthiasen"," Miljøminister "," (A)",1977-02-26,1978-08-30,"Regeringen-Anker-Joergensen-II",1975-02-13,1978-08-30,1.50684931506839,0
